statut,NCTId,eudraCT,completion_year,clinical_trial_title,acronym,results_1y,results_3y,results
游린,NCT00148278,,2005,"Prospective, Multicenter, Randomized, Double-Blind Study Comparing Safety and Efficacy of Norepinephrine Plus Dobutamine Versus Epinephrine Alone in Septic Shock.",CATS,False,False,True
游린,NCT00167609,,2006,Phase 3 Study of Oral Dehydroepiandrosterone (DHEA) in Adults With Myotonic Dystrophy,,False,False,True
游린,NCT00978783,,2009,Speech Effects of a Speaking Valve Versus External PEEP in Tracheostomized Ventilator-Dependent Neuromuscular Patients,,False,False,False
游린,NCT00320099,,2009,Phase 3 Study of Corticotherapy (Hydrocortisone Alone Versus Hydrocortisone Plus Fludrocortisone) Versus Corticotherapy Plus Intensive Insulin Therapy for Septic Shock,COIITSS,False,False,True
游린,NCT00167622,,2009,Efficacy and Safety of Preventive Mechanical Ventilation in Adults With Guillain Barr칠 Syndrome,,False,False,True
游릲,NCT01479959,,2011,Determination of Optimal PEEP Level Under Patient Control in Tracheostomized Ventilated Patients,OptiPEP,False,True,True
游릴,NCT00318942,,2012,CRISTAL: Colloids Compared to Crystalloids in Fluid Resuscitation of Critically Ill Patients: A Multinational Randomised Controlled Trial,,True,True,True
游릴,NCT00625209,,2016,Phase III of Recombinant Human Activated Protein C and Low Dose of Hydrocortisone and Fludrocortisone in Adult Septic Shock,APROCCHS,True,True,True
