statut_color,statut,statut_name,NCTId,eudraCT,CTIS,completion_year,clinical_trial_title,acronym,intervention_type
⬛,4,4 : pas de résultats postés ni publiés,NCT00221754,,,2004,Pravastatin in HIV-Infected Patients Treated With Highly Active Antiretroviral Therapy,,DRUG
⬛,4,4 : pas de résultats postés ni publiés,NCT00221624,,,2004,Randomized Placebo-Controlled Trial of a Triple Therapy Combining Peginterferon Alfa-2a Plus Ribavirin Plus Amantadine Versus Peginterferon Alfa-2a Plus Ribavirin Plus Placebo in Hepatitis C-Infected Patients Non Responders to a First-Line Therapy of Interferon and Ribavirin,PEGARI,DRUG
⬛,4,4 : pas de résultats postés ni publiés,NCT00221650,,,2004,Efficacy and Safety of Peginterferon alfa2a and Ribavirin for the Second Line Treatment of Chronic Hepatitis C in HIV Infected Patients Previously Non Responders to a First Anti-HCV Treatment,ROCO2,DRUG
🟥,3,3 : résultats postés ou publiés après les 36 mois,NCT03181802,,,2005,Are Paraspinous Intramuscular Injections of Botulinum Toxin A (BoNT-A) Efficient in the Treatment of Chronic Low-back Pain?,BoNT-A,DRUG
🟥,3,3 : résultats postés ou publiés après les 36 mois,NCT00273663,,,2006,The Effects of Transcranial Electrical Stimulation (TCES) on Cerebral Blood Flow (CBF) With Xenon Under Computerized Tomography (Xe/CT),,DEVICE
⬛,4,4 : pas de résultats postés ni publiés,NCT00221793,,,2006,Study of Ponderal Load in Parkinsonian Patients After Deep Brain Stimulation of the Subthalamic Nucleus,,PROCEDURE
⬛,4,4 : pas de résultats postés ni publiés,NCT00454259,,,2007,"Fentanyl Ultra Low Doses Effects on Human Volunteer's Nociceptive Threshold. Towards a Simple Pharmacological Test Able to Predict Pain Vulnerability, Post Operative Hyperalgesia Development Risk?",FENTANULD,DRUG
🟥,3,3 : résultats postés ou publiés après les 36 mois,NCT00539916,,,2008,Effects of Regular and Consequent Citrus Fruit Consumption on Vascular Protection Specific Role of the Component Phytomicronutrients,AGRUVASC,BEHAVIORAL
🟥,3,3 : résultats postés ou publiés après les 36 mois,NCT00438035,,,2008,Evaluation of Postoperative Pain by Spectral Analysis of ECG R-R Intervals,ECG-Spectral,PROCEDURE
🟥,3,3 : résultats postés ou publiés après les 36 mois,NCT00413257,,,2008,Study of the Effects of Nefopam on Hyperalgesia Following Sternotomy in Cardiac Surgery,NefalCard,DRUG
⬛,4,4 : pas de résultats postés ni publiés,NCT00461955,,,2009,Pilot Clinical Trial of Injection of ex Vivo Amplified G-CSF Mobilised Autologous Peripheral Blood Stem Cell Transplantation in Adult Patients With Multiple Myeloma in First Response,Expansion,PROCEDURE
⬛,4,4 : pas de résultats postés ni publiés,NCT00534690,,,2009,"Lowering VT and Increasing PEP During One-Lung Ventilation (OLV), Impact on Oxygenation",REVOLU,PROCEDURE
🟥,3,3 : résultats postés ou publiés après les 36 mois,NCT00808730,,,2009,Role of Mitochondria in Human Bronchial Smooth Muscle Remodeling in Non Severe Asthma,MITASTHME,PROCEDURE
⬛,4,4 : pas de résultats postés ni publiés,NCT00304850,,,2009,Efficacy of a Polyamine-free Diet Associated or Not With Ketamine on Early and Late Hyperalgesia After Breast Cancer Surgery,PoLyDOL,DRUG
🟥,3,3 : résultats postés ou publiés après les 36 mois,NCT00556738,,,2009,Intrapulmonary Percussive Ventilation and Nasal Continuous Positive Airway Pressure Ventilation in Transient Respiratory Distress of the Newborn: A Randomized Controlled Trial,HFPV,PROCEDURE
⬛,4,4 : pas de résultats postés ni publiés,NCT00838266,,,2009,"A Double Blind Randomized, Placebo-controlled, Cross-over Trial to Evaluate the Efficiency of a Mouthrinse, Containing Red Grape Seed Extract and nicométhanol Fluorhydrate, in the Control of Dental Plaque Deposit in a 4-days Plaque Regrowth Model",Bain de bouche,OTHER
⬛,4,4 : pas de résultats postés ni publiés,NCT00882297,,,2009,Subclavian Vein Ultrasound Guided Cannulation in Adult: Transversal and Longitudinal Approach Comparison,CATETEL,PROCEDURE
⬛,4,4 : pas de résultats postés ni publiés,NCT00560456,,,2009,Chronic Sleep Restriction and Driving in Healthy Subjects or Snorers : Interindividual Vulnerability and Recovery Factors,PRIVASOM,OTHER
⬛,4,4 : pas de résultats postés ni publiés,NCT00337051,,,2010,Sevoflurane-induced Prevention of Ischemia-reperfusion Lesions in Renal Allograft Transplants Recipients,SévoRein,DRUG
⬛,4,4 : pas de résultats postés ni publiés,NCT01223157,,,2010,Saliva and Plasma Endocannabinoids Concentrations According to Feeding Status and Body Mass Index,SALIVENDO,BIOLOGICAL
🟧,2,2 : résultats postés ou publiés entre 12 et 36 mois,NCT00221702,,,2010,"Randomized, Multicenter Phase III Trial Comparing Adjuvant Treatment With PegIntron Over 36 Months Versus Reference Treatment With IntronA Over 18 Months in Cutaneous Melanoma Patients AJCC Stage II (>=1.5 mm Clinically Node Negative)",EADO,DRUG
⬛,4,4 : pas de résultats postés ni publiés,NCT00479934,,,2010,Phase II Randomized Double Blind Clinical Trial of'Imatinib Mesylate STI571 (Glivec®) Versus Placebo in Patients With Severe Cutaneous Scleroderma or Systemic Sclerosis With Severe Cutaneous Involvement.,SCLEROGLIVEC,DRUG
⬛,4,4 : pas de résultats postés ni publiés,NCT00825422,,,2010,Assessment of Efficacy and Safety of Continuous Wound Infiltration With Local Anesthesics Through a Parietal Paravertebral Catheter for Postoperative Analgesia After Posterior Lumbar Arthrodesis,ICALP,DRUG
🟥,3,3 : résultats postés ou publiés après les 36 mois,NCT00486577,,,2010,Chronic Electrical Stimulation of the Auditory Cortex for Intractable Tinnitus,ACOUSCO,PROCEDURE
🟧,2,2 : résultats postés ou publiés entre 12 et 36 mois,NCT00241228,,,2010,Impact of High-volume Veno-venous Continuous Hemofiltration in the Early Management of Septic Shock Patients With Acute Renal Failure,IVOIRE,DEVICE
⬛,4,4 : pas de résultats postés ni publiés,NCT00506870,,,2010,Economic and Medical Evaluation of Self-monitoring of Anticoagulation in a Population of Patients Recently Fitted With a Mechanical Heart Valve Compared to Conventional Anticoagulation Follow-up,4A,DEVICE
⬛,4,4 : pas de résultats postés ni publiés,NCT00926432,,,2010,"3D Evaluation of Postural Balance of the Adult Affected by Postural Trouble, Using EOS™ Images and 3D-reconstructions With Regard to Gravity Line.",POSTURADULT,DEVICE
⬛,4,4 : pas de résultats postés ni publiés,NCT00221767,,,2010,Prospective Comparative Multicenter Study on the Medico-economical Impact of the Brindley Technique in the Management of Neurogenic Bladder in Patients With Injured Spinal Cord,BRINDLEY,DEVICE
⬛,4,4 : pas de résultats postés ni publiés,NCT01223144,,,2011,Decision-making and Emotion Recognition in Essential Tremor,EMOTREM,BEHAVIORAL
⬛,4,4 : pas de résultats postés ni publiés,NCT01043198,,,2011,Phenotypic Characterization and Array CGH Analysis in Patients With Syndromic Obesity of Unknown Etiology,REMOB,GENETIC
🟥,3,3 : résultats postés ou publiés après les 36 mois,NCT01047852,,,2011,Sequential and Early Used of Noninvasive Ventilation After Extubation in Hypercapnic Patients or in Patients With Chronic Respiratory Disorders,VHYPER,PROCEDURE
🟥,3,3 : résultats postés ou publiés après les 36 mois,NCT00478985,,,2011,Evaluation of the Persistence of the Complete Molecular Remission After Stopping Imatinib Chronic Myeloid Leukemia (STIM),STIM,BEHAVIORAL
⬛,4,4 : pas de résultats postés ni publiés,NCT00741949,,,2011,Fiberoptic Bronchoscopy With Broncho-alveolar Lavage Under Noninvasive Ventilation With Propofol Target Controled Infusion in Patient With Acute Hypoxemic Respiratory Failure. A Randomized Controlled Study : SEDA-FIBRO.,SEDA-FIBRO,DRUG
🟥,3,3 : résultats postés ou publiés après les 36 mois,NCT01069445,,,2011,"Open Label, Randomized Study of the Impact of Diet on Gut Microbiota, Inflammageing and Oxidative Stress in Elderly People. Potential Benefits of Dietary Advices Alone or Associated to Nutraceutical Food Supplements Argan Oil, VSL#3 Probiotic Blend, 5203-L Fruit Extract Terpene. French Part of a Multicentric European Study",RISTOMED,DIETARY_SUPPLEMENT
🟥,3,3 : résultats postés ou publiés après les 36 mois,NCT01070004,,,2011,Countermeasures for Sleepiness at the Wheel and Prediction of Inter- Individual Differences to Their Responses (KillSleep),KILLSLEEP,OTHER
⬛,4,4 : pas de résultats postés ni publiés,NCT00804804,,,2011,"Aging,Sleep and Cognitive Process",SOMVIE,OTHER
⬛,4,4 : pas de résultats postés ni publiés,NCT00931333,,,2011,"Non Comparative, Monocentric, Prospective, Phase II, Study of Calcium Phosphate Cement MCPC Efficacy and Safety for Bone Filling in Vertebral Site",VERTEBRO-MCPC,PROCEDURE
⬛,4,4 : pas de résultats postés ni publiés,NCT00743561,,,2011,Study of the Performance of Ambulatory Nocturnal Polygraphy in the Diagnosis of Sleep Apnea in Multiple System Atrophy,,DEVICE
🟥,3,3 : résultats postés ou publiés après les 36 mois,NCT00607854,,,2011,Safety and Efficacy of Ibritumomab Tiuxetan (Zevalin®) in Association With a Fludarabine Based Reduced Conditioning Regimen and Allogenic Stem Cell Support in Chemo-sensitive Relapsed CD20 Positive Aggressive Non-Hodgkin's Lymphoma Patients.,ZEVALLO,DRUG
⬛,4,4 : pas de résultats postés ni publiés,NCT00624728,,,2011,Assessment of 18Fluoro-thymidine PET-CT for the Volume Definition of High-grade Gliomas (GLIO-TEP) : Correlation With Histopathology,GLIO-TEP,RADIATION
🟥,3,3 : résultats postés ou publiés après les 36 mois,NCT00949806,,,2011,"Phase II Non Comparative, Open Study to Assess the Efficacy and Safety of the Botulinum Toxin Type A in Patients With Restless Legs Syndrome (RLS)",SOXIS,DRUG
⬛,4,4 : pas de résultats postés ni publiés,NCT01167790,,,2012,Interest of Oral Tissue Autofluorescence for the Screening of Precancerous Lesions and Cancer in Population With Tobacco and Alcohol Abuse.,FLUOK,PROCEDURE
🟧,2,2 : résultats postés ou publiés entre 12 et 36 mois,NCT00459589,,,2012,Nutritional Intervention in Geriatric Oncology in Patients at Risk of Undernutrition,INOGAD,BEHAVIORAL
⬛,4,4 : pas de résultats postés ni publiés,NCT00437762,,,2012,Effectiveness of Botulinum Toxin A Injection for the Treatment of Lateral Epicondylitis Unrelieved by Usual Medical Cares : A Double Blind Randomized Controlled Trial Versus Placebo,TBA,DRUG
⬛,4,4 : pas de résultats postés ni publiés,NCT00510640,,,2012,"Phase 2 of Sunitinib (Sutent) in Patients With Locally Advanced or Metastatic Anaplastic, Differentiated or Medullar Thyroid Cancer",THYSU,DRUG
⬛,4,4 : pas de résultats postés ni publiés,NCT00646269,,,2012,Efficacy Assessment of Three Non Pharmacological Therapies in Alzheimer's Disease,ETNA3,BEHAVIORAL
🟧,2,2 : résultats postés ou publiés entre 12 et 36 mois,NCT00896428,,,2012,Effects of Gallopamil on Bronchial Smooth Muscle Remodelling in Severe Asthma: a Double Blind Study.,REMODEL'ASTHME,DRUG
⬛,4,4 : pas de résultats postés ni publiés,NCT01421953,,,2012,Assessment of Four-dimensional (4D) 18F-fluoro-deoxy-glucose (FDG) Positron Emission Tomography and Computed Tomography System (PET-CT) in Radiotherapy for Non Small Cell Lung Cancers (NSCLC),PULMOTEP,DEVICE
🟥,3,3 : résultats postés ou publiés après les 36 mois,NCT00241254,,,2012,"A Double-blind, Two-arm, Multicenter, Randomized Trial to Evaluate Efficacy of Cyclophosphamide Versus Methylprednisolone in Patients With Recent Secondary Progressive Multiple Sclerosis: P.R.OM.E.S.S Study",PROMESS,DRUG
⬛,4,4 : pas de résultats postés ni publiés,NCT01178164,,,2012,Prevalence of Fabry's Disease in a Population of Patients With Chronic Pains,DOUFAB,GENETIC
🟥,3,3 : résultats postés ou publiés après les 36 mois,NCT00833209,,,2012,Orbitofrontal Cortex (OFC) Influence on Addictive Behaviour in Medication Overuse Headache (MOH) Deriving From Migraine,MOH-PET,PROCEDURE
⬛,4,4 : pas de résultats postés ni publiés,NCT01170793,,,2012,Medication Overuse Headaches: the Impact of Educative Telephone Coaching Administered by Nurses Prior to the Medical Appointment in a Tertiary Consultation Center: a Comparative Randomized Trial,CAM-ET,BEHAVIORAL
⬛,4,4 : pas de résultats postés ni publiés,NCT01220349,,,2012,Early Detection of Diabetic Cardiomyopathy by Analysis of Myocardial Deformations by Two-dimensional Speckle Tracking Strain Echocardiography and Relationship to Micro-angiopathy,ECHO-DIAB,DEVICE
⬛,4,4 : pas de résultats postés ni publiés,NCT00916253,,,2012,"Method of Assessment of Driving Ability in Patients Suffering From Wakefulness Pathologies, Impact of Modafinil Treatment.",AUTOSOP,DRUG
🟥,3,3 : résultats postés ou publiés après les 36 mois,NCT01056952,,,2012,Physiologic Effects of High Flow Nasal Therapy in Patients With Acute Hypoxemic Respiratory Failure,,PROCEDURE
⬛,4,4 : pas de résultats postés ni publiés,NCT00614081,,,2013,Measurement of Glomerular Filtration Rate With Contrast-enhanced Dynamic MR Imaging in Renal Transplant Recipients: Evaluation of the Agreement With the Cr51 -EDTA Method and of Reproducibility,IREN,DEVICE
⬛,4,4 : pas de résultats postés ni publiés,NCT00917709,,,2013,In Vivo SPECT Imaging of Vesicular Acetylcholine and Dopamine Transporters in Dementia With Lewy Bodies: Applying in Diagnostic and Identification of Pathological Subtypes.,IBVM/DATSCAN,OTHER
🟥,3,3 : résultats postés ou publiés après les 36 mois,NCT00590837,,,2013,"Randomized Prospective Study of Adding Lomustine to Idarubicin and Cytarabine for Induction and Post-remission Chemotherapy in Older Patients With Acute Myeloid Leukaemia, and Feasibility of Allogeneic Transplantation for Patients From 60 to 65 Years Old",LAM-SA 2007,DRUG
⬛,4,4 : pas de résultats postés ni publiés,NCT00906893,,,2013,Methodological Evaluation of Fluor 18 Labelled Fluoromisonidazole ([18F]-FMISO) Positon Emission Tomography-Computed Tomography (PET-CT) for Non Operated Glioblastoma,MISOGLIO,PROCEDURE
⬛,4,4 : pas de résultats postés ni publiés,NCT00657475,,,2013,A Prospective Study of Coronary Artery Bypass Graft and/or Aortic Valve Replacement With Conventional Versus Half Heparin Dose Under Closed and Coated Extra Corporeal Circulation System (MECC) - APPACHES Study.,APPACHES,DRUG
⬛,4,4 : pas de résultats postés ni publiés,NCT00790686,,,2013,Study of Tolerance and Effectiveness of Ureteral Stents MEMOKATH ® 051 in the Treatment of Chronic Strictures of the Ureter,TOTEME,PROCEDURE
⬛,4,4 : pas de résultats postés ni publiés,NCT02889224,,,2013,In Vivo Study of Interactions Between the Endocannabinoid System and the Corticotropic Axis in Man,VISECA,OTHER
⬛,4,4 : pas de résultats postés ni publiés,NCT01288313,,,2013,Effect of N-3 Polyunsaturated Fatty Acids Supplementation on the Human Milk Composition of Lactating Women: Nutritional Intervention With Rapeseed Oil and n-3 Margarine Compared to Standard Olive Oil,Oméga 3,DIETARY_SUPPLEMENT
⬛,4,4 : pas de résultats postés ni publiés,NCT00624403,,,2013,LMA ProSeal & I-Gel : a Prospective Controlled Trial,I-Gel,DEVICE
⬛,4,4 : pas de résultats postés ni publiés,NCT01149525,,,2013,"A Randomised, Double Blinded Cross-over Study Comparing the Efficacy of L-carnitine Versus Placebo in the Treatment of Fatigue in Multiple Sclerosis",FACTSEP,DRUG
⬛,4,4 : pas de résultats postés ni publiés,NCT01082419,,,2013,Acoustic Radiation Force Impulse Imaging (ARFI) : a New Technique to Assess Liver Elasticity - Norms in ARFI: Distribution and Reproducibility of ARFI Values in Disease-free Livers or Pathological Livers.,NARFI,DEVICE
⬛,4,4 : pas de résultats postés ni publiés,NCT01604694,,,2013,"Ultrasound-guided Transversus Abdominis Plane Block for Analgesia After Abdominoplasty: Randomized- Controlled- Trial Double Blind Monocentric Study, Against Placebo",TAPlastie,PROCEDURE
⬛,4,4 : pas de résultats postés ni publiés,NCT01803971,,,2013,Obtaining Vascular Access (Venous or Intraosseous) During Cardiac Arrest in Out-of-hospital Care: Delays and Failure Risk Factors,ACCIO,OTHER
⬛,4,4 : pas de résultats postés ni publiés,NCT01849536,,,2013,Corneal Biomechanics and Continuous IOP Monitoring Using Soft Contact Lenses in Glaucomatous Patients,BIOLENS,DEVICE
🟥,3,3 : résultats postés ou publiés après les 36 mois,NCT01269697,,,2013,Lutein Influence on Macula of Persons Issued From Amd Parents,LIMPIA,DIETARY_SUPPLEMENT
⬛,4,4 : pas de résultats postés ni publiés,NCT00869882,,,2013,Comparison of 2 Surgical Approaches in the Treatment of Degenerative Spondylolysthesis: Posterolateral Fusion With Instrumentation (GPLI) Plus or Minus Transforaminal Lumbar Interbody Fusion (TLIF),SPONGIT,PROCEDURE
🟧,2,2 : résultats postés ou publiés entre 12 et 36 mois,NCT01160874,,,2013,Sleepiness and Performances Degradation in Adults Presenting an Attention-Deficit/ Hyperactivity Disorder (ADHD),SOMTDA/H,OTHER
⬛,4,4 : pas de résultats postés ni publiés,NCT01555827,,,2014,Retinal Neurodegenerative Signs in Alzheimer's Diseases,SIGNAL,OTHER
⬛,4,4 : pas de résultats postés ni publiés,NCT01517789,,,2014,Advantage of Using Intraoperative Visual Evoked Potentials to Preserve Visual Function During Surgical Procedures Near the Optical Pathways,VISUOPEV,DEVICE
⬛,4,4 : pas de résultats postés ni publiés,NCT01619644,,,2014,Rubinstein-Taybi Syndrome: Functional Imaging and Therapeutic Trial,RUBIVAL,DRUG
🟥,3,3 : résultats postés ou publiés après les 36 mois,NCT01270646,,,2014,Study of the Role of Intraventricular Electrical Activation in the Treatment of Congestive Heart Failure by Cardiac Resynchronization Therapy: Invasive Evaluation and Validation of Non-Invasive Strategy Using CardioInsight ®,CARTO-CRT,DEVICE
⬛,4,4 : pas de résultats postés ni publiés,NCT02056912,,,2014,Identification of a New Gene Involved in Hereditary Lipodystrophy - LIPOGENE,LIPOGENE,GENETIC
⬛,4,4 : pas de résultats postés ni publiés,NCT00906672,,,2014,,INTEGRA®,DEVICE
⬛,4,4 : pas de résultats postés ni publiés,NCT01421927,,,2014,Safety of a Maintenance Therapy With Lenalidomide After Reduced-intensity Allogeneic Stem Cell Transplantation for Chemosensitive Relapsed Multiple Myeloma,REVALLO,DRUG
⬛,4,4 : pas de résultats postés ni publiés,NCT01613989,,,2014,Total Hip Prosthesis Assisted by Computer Based on Pre-operative EOS Imaging,NAVEOS,PROCEDURE
⬛,4,4 : pas de résultats postés ni publiés,NCT01235052,,,2014,Prognostic Evaluation of Fluor 18 Labelled FLUROMISONIDAZOLE (18F-FMISO) Positon Emission Tomography-Computed Tomography (PET-CT) in Head and Neck Squamous Cell Carcinomas,MISORL,RADIATION
⬛,4,4 : pas de résultats postés ni publiés,NCT01034449,,,2014,Transplantation of Ex-vivo Expanded Human Cord Blood Hematopoietic Stem Cells Expanded: Evaluation of Hematopoietic and Immunologic Reconstitution After a Reduced-intensity Conditioning Regimen,GRAPA,OTHER
⬛,4,4 : pas de résultats postés ni publiés,NCT01365858,,,2014,Effectiveness of Virtual Reality-based Cognitive Training in Daily Living in Stroke Patients Using Virtual Action Planning Supermarket (VAP-S),VAPS REHAB,OTHER
⬛,4,4 : pas de résultats postés ni publiés,NCT01234415,,,2014,"Multicentric Pilot, Clinical Study of a Bone Substitute Safety and Efficacy in the Multi Traumatized Nasal Septum Reconstruction",NASEPT,DEVICE
⬛,4,4 : pas de résultats postés ni publiés,NCT02113254,,,2014,Study of Modification of the Density of the Macular Pigment by the Consumption of Corn With Strong Content in Zeaxanthine,MAIS,OTHER
⬛,4,4 : pas de résultats postés ni publiés,NCT01844440,,,2014,Diagnostic of Transient Lower Esophageal Sphincter Relaxation With Combined Impedance and High Resolution Manometry in Patients With GERD.,HRM RTSIO,PROCEDURE
🟥,3,3 : résultats postés ou publiés après les 36 mois,NCT01344512,,,2014,"Population Pharmacokinetics Of Ceftazidime, Ciprofloxacin And Voriconazole In Paediatric Young Patients (< 12 Years Old)",PHARMA-A,DRUG
⬛,4,4 : pas de résultats postés ni publiés,NCT01484821,,,2014,,CAPARFI,DEVICE
⬛,4,4 : pas de résultats postés ni publiés,NCT01582919,,,2015,STUDY OF IMAGING MARKERS IN THE VERY EARLY STAGES OF DEMENTIA AMONG RETIRED RURAL FARM IN THE GIRONDE AND PARTICIPATING IN THE AMI COHORT EPIDEMIOLOGY: A LONGITUDINAL STUDY.,AMIMAGE 2,OTHER
⬛,4,4 : pas de résultats postés ni publiés,NCT02806466,,,2015,Risk Factors for Early Remodelling in Severe Asthma in Children,P'tit-ASTHME,PROCEDURE
⬛,4,4 : pas de résultats postés ni publiés,NCT01556035,,,2015,A Multicentre Prospective Phase II Single Arm Trial Evaluating the Benefit of Therapy With Lenalidomide (Revlimid®) in Relapsed or Refractory Primary-cutaneous Large B-cell Lymphoma (Leg-type) After First Line Treatment by Chemotherapy Plus Rituximab for the French Study Group of Cutaneous Lymphoma (GFELC),REV-LEG,DRUG
⬛,4,4 : pas de résultats postés ni publiés,NCT01260402,,,2015,Randomized Comparison of Endocardial Versus Epicardial - From the Coronary Sinus - Left Ventricular Pacing for Resynchronization in Heart Failure.,EPI-ENDO,DEVICE
🟧,2,2 : résultats postés ou publiés entre 12 et 36 mois,NCT01275521,2010-022255-37,,2015,"Study of the Effectiveness and the Tolerance of Intraprostatic A-botulinic Toxin Injection, in the Treatment of Symptomatic Benign Prostate Hypertrophy.",PROTOX,DRUG
🟧,2,2 : résultats postés ou publiés entre 12 et 36 mois,NCT01629303,,,2015,Efficacy of Sacral Nerve Modulation in Severe Refractory Constipation,CONSTIMOD,PROCEDURE
⬛,4,4 : pas de résultats postés ni publiés,NCT01273259,,,2015,Study of Dehydroepiandrosterone (DHEA) in Respiratory Pulmonary Hypertension in Adults. Phase 2 Trial,,DRUG
⬛,4,4 : pas de résultats postés ni publiés,NCT01335243,,,2015,"Multicentric, Prospective Study of Efficacy and Safety of Lumbar Interbody Fusion With MatriTMBONE Associated With Autologous Marrow",MatriBone,PROCEDURE
🟥,3,3 : résultats postés ou publiés après les 36 mois,NCT02246829,,,2015,Assessment of Early Changes in SD-OCT After Initiation of a Treatment by Intravitreal Aflibercept (EYLEA®) (2mg) Over a 12-week Period for Patients Suffering From Neovascular Age-related Macular Degeneration (AMD) French SD OCT in wAMD,START,PROCEDURE
⬛,4,4 : pas de résultats postés ni publiés,NCT01845935,,,2015,Cryoablation of Venous Vascular Malformations Located in Soft Tissues,CRYOMAV,DEVICE
⬛,4,4 : pas de résultats postés ni publiés,NCT01928238,,,2015,Physiologic Effects of Noninvasive Neurally Adjusted Ventilatory Assist (NAVA) Versus Noninvasive Pressure Support Ventilation in Patients at Risk for Respiratory Distress Needed Preventive Used of Noninvasive Ventilation After Extubation.,NAVA-VNI,DEVICE
⬛,4,4 : pas de résultats postés ni publiés,NCT02812511,,,2015,"Pathophysiology Analysis of ""Costello Syndrome"" on Cellular Models",COSTELLO,PROCEDURE
🟥,3,3 : résultats postés ou publiés après les 36 mois,NCT01064193,,,2015,"Influence of Local Biopsy of the Endometrium Prior to Controlled Ovarian Stimulation for IVF or ICSI Procedure on the Rates of Embryo Implantation, Clinical Pregnancy and Live Birth in ART",NIDABRECHE,PROCEDURE
⬛,4,4 : pas de résultats postés ni publiés,NCT01334073,,,2015,Phase I Study of the Combination of Axitinib (AX) Plus Everolimus (EV) in Patients With Malignant Advanced Solid Tumors,EVAX,DRUG
⬛,4,4 : pas de résultats postés ni publiés,NCT01269567,,,2015,Randomized Trial Comparing Drainage Versus no Drainage Following Rectal Excision With Low Anastomosis for Rectal Cancer,GRECCAR 5,PROCEDURE
⬛,4,4 : pas de résultats postés ni publiés,NCT01650454,,,2015,,SCOAL,OTHER
⬛,4,4 : pas de résultats postés ni publiés,NCT01212926,,,2015,Early Detection of Anthracycline Cardiotoxicity by Echocardiographic Analysis of Myocardial Deformation in 2D Strain,CA2D,DEVICE
⬛,4,4 : pas de résultats postés ni publiés,NCT01854970,,,2015,Benefit of Pharyngeal and Oesophageal pH-impedance of Patients With High Suspicion of Laryngopharyngeal Reflux,PHARO,DRUG
🟥,3,3 : résultats postés ou publiés après les 36 mois,NCT01066559,,,2015,Multicentric Randomized Trial of the Impact of Hemodialysis With Polymethylmetacrylate Membrane on the Improvement of Humoral Immune Response in the Hemodialyzed Patients: Application to Hepatitis B Vaccination and Correlation to sCD40 Clearing,HEPADIAL,PROCEDURE
🟥,3,3 : résultats postés ou publiés après les 36 mois,NCT02505386,,,2016,Pharmacokinetics of Ertapenem Following Subcutaneous or Intravenous Infusion in Patients Aged Over 75 (PHACINERTA),PHACINERTA,DRUG
⬛,4,4 : pas de résultats postés ni publiés,NCT01254474,,,2016,Evaluation of Depolarization and Repolarisation Activity During Cardiac Arrhythmia Using a Novel Monophasic Action Potential Catheter,EvaMAP,DEVICE
⬛,4,4 : pas de résultats postés ni publiés,NCT01432067,,,2016,,CAPADOGE,OTHER
⬛,4,4 : pas de résultats postés ni publiés,NCT01931228,,,2016,Contribution of Mechanical Insufflation-Exsufflation in Preventing Respiratory Failure Post Extubation in Patient With Critical Care Neuromyopathy,NEUROMIE,PROCEDURE
⬛,4,4 : pas de résultats postés ni publiés,NCT02591303,,,2016,Stress and Insomnia: Investigating a Bidirectional Relation,StresSleep,OTHER
🟧,2,2 : résultats postés ou publiés entre 12 et 36 mois,NCT02100800,,,2016,Assessment of Emphysema in COPD Patients Using 1.5T MR Imaging With Ultrashort Echo Time (UTE) Pulse Sequences,EMPHYREM,OTHER
⬛,4,4 : pas de résultats postés ni publiés,NCT01807884,,,2016,Comparison of Two Strategies of Oropharyngeal and Tracheal Suctioning in Mechanically Ventilated Patients: a Pilot Trial,AMYLASPI,PROCEDURE
