all_sources;has_results;NCTId;other_ids;title;acronym;summary;study_start_date;study_start_date_type;status;study_completion_date;study_completion_date_type;study_first_submit_date;study_first_submit_qc_date;study_type;time_perspective;enrollment_count;enrollment_type;references;has_publications_result;has_results_or_publications;ipd_sharing;lead_sponsor;location_country;location_facility;snapshot_date;study_start_year;study_completion_year;delay_submission_start;submission_temporality;delay_start_completion;lead_sponsor_type;french_location_only;status_simplified;bso_country;has_publication_oa;publication_access;intervention_type;design_allocation;primary_purpose;eudraCT;publications_result;results_first_submit_date;results_first_submit_qc_date;first_results_or_publication_date;delay_first_results_completion;ipd_sharing_description;WHO;ISRCTN
['clinical_trials'];False;NCT00598026;[{'type': 'org_study_id', 'id': 'DGS 2007-A00888-45', 'source': 'clinical_trials'}, {'type': None, 'id': 'LOC/07-04', 'source': 'clinical_trials'}, {'type': None, 'id': 'CIC 0203/076', 'source': 'clinical_trials'}];"Evaluation of the "" Tele-follow-up "" for the Follow-up of Implantable Defibrillators";EVATEL;"The implantable cardioverter defibrillator (ICD) has been shown to be effective in preventing mortality in patients with ventricular tachyarrhythmia. However, the expanding indications of this therapy will have an impact on the follow-up policy. Currently, regular follow-up visits are scheduled every 3 months. In this context, the recently-introduced ""remote monitoring"" devices constitute a promising new technique, allowing to transmit information about the status of the device and ICD therapies, without direct contact between patients and physicians. This monitoring by ""tele-follow-up"" might reduce the cost of care by avoiding useless visits to the implantation centre.

The aim of our study is to assess the cost-benefit ratio of ""tele-follow-up"" assisted care as compared with the conventional ICD follow-up.";2008-01-28T00:00:00;;Completed;2011-05-28T00:00:00;Actual;2008-01-09T00:00:00;2008-01-17T00:00:00;Interventional;;1501.0;Actual;[];0.0;False;;Rennes University Hospital;['France'];"['Service de Cardiologie - Hôpital Pasteur', ""Service de Cardiologie - CHU d'Angers"", 'Service de Cardiologie - Hôpital Européen Georges Pompidou', 'Département de Cardiologie - CHU de Nancy-Brabois', 'Département de Cardiologie et Maladies Vasculaires - Hôpital de Pontchaillou', 'Service de Cardiologie - Hôpital de la Côte de Nacre', 'Service de Cardiologie - CHU de Clermont-Ferrand', ""Service de Cardiologie - Centre Hospitalier du Pays d'Aix"", 'Service de Cardiologie - CHU de Nîmes', 'Département de Cardiologie - CHU de Montpellier', 'Service de Cardiologie - Institut du Thorax - Hôpital Laennec', 'Service de Cardiologie B - Hôpital Trousseau', 'Institut de Cardiologie - Hôpital de la Pitité Salpétrière', 'Service de Cardiologie - CHU de Limoges', 'Service de Cardiologie - CHU Jean Minjoz', 'Service de Chirurgie Cardiovasculaire - Hôpital Rangueil', 'Service médico-chirurgical de Cardiologie - CHU de Poitiers', 'Service de Cardiologie - Hôpital Charles Nicolle', 'Service de Cardiologie - CHU de Saint Etienne', 'Service de Cardiologie -Hôpital de la Cavale Blanche', 'Cardiologie A - CHRU de Lille', 'Service de Cardiologie - Hôpital Lariboisière', 'Service de Cardiologie - Hôpital Henri Mondor', 'Service de cardiologie et Urgences cardiologiques - Hôpital Michallon', 'Service de Cardiologie - Groupement Hospitalier Est de Lyon', 'Département de Cardiologie - CHU de Reims', 'Centre de Cardiologie - CHU de Dijon', 'Service de Cardiologie - CHU Timone Adultes', 'Hôpital Cardiologique du Haut Lévêque - CHU de Bordeaux', 'Service de Cardiologie - Hôpital de Hautepierre']";2022-11-28;2008.0;2011.0;-19.0;before_start;1216.0;academique;True;Completed;['fr'];;[];Other;Randomized;;;;;;;;;;
['clinical_trials'];False;NCT00401336;[{'type': 'org_study_id', 'id': 'DGS 2006/0197', 'source': 'clinical_trials'}, {'type': None, 'id': 'PHRC/04-08', 'source': 'clinical_trials'}, {'type': None, 'id': 'CIC0203/044', 'source': 'clinical_trials'}];Quantification of Liver Iron Overload and Steatosis Using a New Magnetic Resonance Imaging Multiecho Gradient-echo Sequence;SURFER;Iron excess is increasingly regarded as an important cofactor in the morbidity attributed to many disorders. Assessment of body iron stores by measurement of serum ferritin concentrations has poor specificity and the most reliable method is histological or biochemical assessment from a liver biopsy. Because liver biopsy is an invasive procedure, imaging methods have been developed to detect and quantify hepatic iron content. The aim of the study is to use a simplified magnetic resonance imaging (MRI) technique to quantify simultaneously iron and fat contents in the liver and to compare the results to the quantification obtained biochemically.;2006-11-28T00:00:00;;Completed;2013-03-28T00:00:00;Actual;2006-11-17T00:00:00;2006-11-17T00:00:00;Interventional;;250.0;Anticipated;[];0.0;False;;Rennes University Hospital;['France', 'Spain'];['Hôpital de Pontchaillou', 'Hôpital de la Timone', 'Hôpital Edouard Herriot', 'Hôpital du Brabois', 'CHU Angers', 'Hôpital Huriez', 'Hôpital Beaujon', 'Hôpital Tenon', 'Hôpital Saint Eloi', 'Hopital Donostia-San Sebastian'];2022-11-28;2006.0;2013.0;-11.0;before_start;2312.0;academique;False;Completed;['fr'];;[];Device;N/A;Diagnostic;;;;;;;;;
['clinical_trials'];False;NCT04742465;[{'type': 'org_study_id', 'id': '35RC20_8889_ARIADE', 'source': 'clinical_trials'}, {'type': 'Other Identifier', 'id': '2021-A00062-39', 'source': 'clinical_trials'}];ARIADE : Augmented Reality for Improving Autonomy in Dementia. Creation, Implementation and Testing of an Augmented Reality Tool to Help People With Alzheimer's Type Dementia in Their Travels.;ARIADE;"Navigating according to a specific goal is a common activity of everyday life. Spatial navigation requires the implementation of motor and perceptual functions (sight, walking, proprioception), but also various cognitive functions (executive functions, memory, spatial orientation skills). Many people affected by a neurodegenerative disease have topographical difficulties which have a major impact on their autonomy in daily life, by gradually limiting their movements outside their home, then inside their home, and which are the main factor leading to the institutionalization of this population. People with dementia or MCI (Mild Cognitive Impairment) of the Alzheimer type, according to the definition of the NIAA (National Institute on Aging-Alzheimer's Association) have navigation and spatial memory disorders, with difficulty in acquiring mental spatial representations of their environment. These topographical difficulties have been shown to be related to the reduction in volume of the temporal cortex, in particular the hippocampal regions, as well as to atrophy of the retrosplenial cortex.

Augmented Reality (AR), often defined as an intermediary between the totally artificial world of VR and the real world in which we operate, makes it possible in particular to add summary information to the natural environment in which a participant operates. Even if, in particular in outside environment, AR must solve many challenges, such as the integration of the real and virtual worlds in real time, the selection of the modalities of restitution of information, its use is exponential in the medical field, in particular in surgery for the assistance of the practitioner, but also in the field of sensory substitution, in particular to facilitate the movements of people with visual impairment. Other works focused in helping people with dementia of the Alzheimer type, such as those of Quintana and Favela (2012) who proposed preliminary systems of annotations in AR. Hervás et al. were the first in 2014 to test the use of augmented reality to provide navigation assistance to people with dementia. In 2017, Firouzian et al. as well as Sejunaite et al. implemented related systems. Firouzian et al. have developed spectacle frames comprising around ten LED lights in order to provide directional indications to people who moved outdoor. However, the influence of this system on navigation performance has not been tested yet. On the other hand, although simple to develop, this system requires training on the part of the users and only makes it possible to provide directional information, which is not recommended for the implementation of a tool for this population. Finally, Sejunaite et al. used an environmentally tested smart glasses to allow users to display information in the form of a map to help older people navigate independently. However, the literature review indicates that even increased card use does not seem to be suitable for people with dementia or Alzheimer's-type MCI. Finally, these two tools do not allow navigational information to be co-located in the field of vision of people, which represents one of the major advantages of augmented reality. To our knowledge, there is not yet an AR device providing co-located information in the environment dedicated to outdoor navigation of people with dementia or Alzheimer's type MCI.";2021-06-07T00:00:00;Actual;Completed;2021-06-25T00:00:00;Actual;2021-02-01T00:00:00;2021-02-05T00:00:00;Interventional;;19.0;Actual;[];0.0;False;No;Rennes University Hospital;['France'];['Rennes University Hospital'];2022-11-28;2021.0;2021.0;-126.0;before_start;18.0;academique;True;Completed;['fr'];;[];Other;N/A;Other;;;;;;;;;
['clinical_trials'];False;NCT01673230;[{'type': 'org_study_id', 'id': '2012-A00364-39', 'source': 'clinical_trials'}, {'type': 'Other Identifier', 'id': 'LOC/12-01', 'source': 'clinical_trials'}];Hemodynamic Indices Predictive of a Beneficial Response to Fluid Expansion in Case of Hemodynamic Failure After Cardiac Surgery With Altered Preoperative Ejection Fraction (LVEF≤45%): Sensibility and Specificity of Respiratory Variations of Pulse Pressure (∆PP), Photoplethysmography (∆POP), Perfusion Index (PVI), Before and After Fluid Expansion.;ALTERVOL;Low Cardiac Output Syndrome occurs frequently after cardiac surgery, especially when pre-operative LVEF is altered (LVEF≤45%). The correction of hemodynamic failure requires adapted treatments: fluid expansion and/or inotropic or vasoactive drugs. Predictive indices of a response to fluid challenge may allow an earlier hemodynamic optimization, which has not been showed until now when LVEF is altered.;2012-09-28T00:00:00;;Completed;2015-12-28T00:00:00;Actual;2012-08-22T00:00:00;2012-08-22T00:00:00;Interventional;;50.0;Actual;[];0.0;False;;Rennes University Hospital;['France'];['Rennes University Hospital'];2022-11-28;2012.0;2015.0;-37.0;before_start;1186.0;academique;True;Completed;['fr'];;[];Procedure;N/A;Other;;;;;;;;;
['clinical_trials'];False;NCT01569724;[{'type': 'org_study_id', 'id': '2010-A23465-21', 'source': 'clinical_trials'}];Estimation of Carbohydrate Metabolism Disorder Frequency in Hypertriglyceridemia Induced by Bexarotene Treatment of Cutaneous T Cell Lymphoma - Pilote Study;TgBEX;Bexarotene is a RXR-selective retinoid, licensed for the treatment of cutaneous T cell lymphoma. The most frequent adverse effect is hypertriglyceridemia but its mechanism is not well known. The purpose of this study is to research a carbohydrate metabolism disorder associated in bexarotene-induced hypertriglyceridemia.;2012-01-28T00:00:00;;Completed;2017-04-28T00:00:00;Actual;2012-02-24T00:00:00;2012-03-30T00:00:00;Interventional;;10.0;Actual;[];0.0;False;;Rennes University Hospital;['France'];['Service de dermatologie - Hôpital de Pontchaillou'];2022-11-28;2012.0;2017.0;27.0;during_study;1917.0;academique;True;Completed;['fr'];;[];Other;N/A;Treatment;;;;;;;;;
['clinical_trials'];False;NCT01543100;[{'type': 'org_study_id', 'id': 'LOC/10-02 - PACMoG', 'source': 'clinical_trials'}, {'type': 'Other Identifier', 'id': '2010-A00378-31', 'source': 'clinical_trials'}, {'type': 'Other Identifier', 'id': 'B100413-10', 'source': 'clinical_trials'}, {'type': 'Other Identifier', 'id': '10/16-758', 'source': 'clinical_trials'}];Prognostic Study of Markers of Angiogenesis and Coagulability in Patients With Monoclonal Gammopathy;PACMoG;Blood circulating endothelial cells (CEC) and microparticles (MPs) are described in the literature to be associated with vascular failures and dysfunction that reflect neo-angiogenesis and risk of thrombosis, respectively. There a few number of CEC in healthy patients although they significantly increase in several cancers including myeloma. However, no study explored to date a correlation of CEC and/or circulating endothelial progenitors (CEP) and MPs with the tumoral growth of monoclonal gammopathy. On the other hand, there is no study measuring the CEC and CEP directly in the bone marrow. The investigators aim is to evaluate these 2 original features in patients with monoclonal gammopathy: monoclonal gammopathy of undetermined signification (MGUS) and myeloma. This is a preliminary multicentric study.;2010-11-28T00:00:00;;Completed;2014-01-28T00:00:00;Actual;2011-08-23T00:00:00;2012-03-01T00:00:00;Interventional;;60.0;Actual;[];0.0;False;;Rennes University Hospital;['France'];['Rennes University Hospital'];2022-11-28;2010.0;2014.0;268.0;during_study;1157.0;academique;True;Completed;['fr'];;[];Other;N/A;Basic Science;;;;;;;;;
['clinical_trials'];False;NCT02864017;[{'type': 'org_study_id', 'id': '35RC14_9835', 'source': 'clinical_trials'}, {'type': 'Other Identifier', 'id': '2015-A00961-48', 'source': 'clinical_trials'}];Immuno Nutrition by L-citrulline for Critically Ill Patients;Immunocitre;The main objective of this study is to demonstrate that the only administration of L-citrulline, can improve immune functions in critically ill patients at high risk of nosocomial infection.;2016-09-28T00:00:00;Actual;Completed;2020-04-28T00:00:00;Actual;2016-08-04T00:00:00;2016-08-08T00:00:00;Interventional;;120.0;Actual;[];0.0;False;No;Rennes University Hospital;['France'];['CHU Nantes', 'CHU Angers', 'Rennes Hospital University', 'Paris - HEGP'];2022-11-28;2016.0;2020.0;-55.0;before_start;1308.0;academique;True;Completed;['fr'];;[];Dietary Supplement;Randomized;Prevention;;;;;;;;;
['clinical_trials'];False;NCT01949467;[{'type': 'org_study_id', 'id': 'FERHEP', 'source': 'clinical_trials'}];Prospective, Comparative (5 Groups), Non-randomized, Multicenter, Physiopathological Study, Evaluating Pharmacokinetic Characteristics of Serum Hepcidin Level in Response to Iron Oral Intake in Order to Evaluate Their Interest to Discriminate Patients With Dysmetabolic Hepatosiderosis or Ferroportin Disease.;;"The diagnosis of iron overload is a common problem. It is important to optimize the diagnosis to ensure support for patients and their relatives especially regarding genetic disease.

Iron overload revealed by a high level of serum ferritin and confirmed by the presence of an excessive amount of iron in the liver is a frequent situation. In a lot of case there is no increase in serum iron and transferrin saturation. This situation may arise in particular in patients with:

a genetic iron overload related to mutation in the ferroportine gene, leading to a ferroportin disease. The diagnosis is based on the sequencing of the gene,
a dysmetabolic hepatosiderosis, the most frequent situation , where iron overload is associated with abnormalities in the metabolism of carbohydrates and fats, whereas no genetic cause is identified.

However, patients often have similar biological signs and despite the implementation of strict algorithm regarding the diagnostic procedure, it appears that a large number of patients are tested for the mutation in the ferroportin gene, and that mutation is not found in most cases. It is therefore essential to optimize the diagnosis process by introducing additional criteria.

The investigators' hypothesis, based on the known elements, is that the response to a single dose of iron will modulate differently the iron parameters measured in serum, including hepcidin level which controls iron metabolism and metals associated with iron. This could be helpful for diagnosis procedure in patients with ferroportin disease or dysmetabolic hepatosiderosis.";2014-02-10T00:00:00;Actual;Completed;2018-12-26T00:00:00;Actual;2013-09-20T00:00:00;2013-09-23T00:00:00;Interventional;;62.0;Actual;[];0.0;False;;Rennes University Hospital;['France'];['CHU Pontchaillou', 'CHU Montpellier', 'CHU Limoges', 'CHU Clermont-Ferrand'];2022-11-28;2014.0;2018.0;-143.0;before_start;1780.0;academique;True;Completed;['fr'];;[];Drug;Non-Randomized;Diagnostic;;;;;;;;;
['clinical_trials'];False;NCT01780883;[{'type': 'org_study_id', 'id': 'ANSM A91245-56', 'source': 'clinical_trials'}];Melatonin Dose-effect Relation in Childhood Autism;MELADOSE;"Melatonin is a neurohormone produced from serotonin which promotes sleep. The alterations in central and peripheral serotonin neurobiology and in circadian sleep-wake rhythms observed in autistic disorder suggest abnormalities in melatonin secretion.

Several studies have reported a decrease in melatonin secretion in individuals with autism. Furthermore, nocturnal excretion of 6-Sulphatoxymelatonin (the predominant melatonin metabolite) was significantly negatively correlated with severity of autistic impairments in verbal communication and play. Melatonin could therefore have a therapeutic effect on sleep problems and may play a role in the pathophysiology of autistic disorder.

These data highlight the possible therapeutic interest of an oral administration of melatonin in patients with autistic disorder. Thus, the objective of this clinical trial is to study the relation between the melatonin dose administered and its effect on severity of autistic impairments especially in verbal communication and play.";2013-02-28T00:00:00;;Completed;2013-09-28T00:00:00;Actual;2013-01-25T00:00:00;2013-01-29T00:00:00;Interventional;;34.0;Actual;[];0.0;False;;Rennes University Hospital;['France'];"[""Pôle de Psychiatrie de l'Enfant et de l'Adolescent - Centre Hospitalier Guillaume Régnier"", 'Centre Hospitalier Spécialisé Henri Laborit', ""Service de Psychiatrie de l'Enfant et de l'Adolescent - Hôpital de la Pitié-Salpêtrière"", ""Service de Psychothérapie de l'Enfant et de l'Adolescent - Hôpital Robert Debré""]";2022-11-28;2013.0;2013.0;-34.0;before_start;212.0;academique;True;Completed;['fr'];;[];Drug;Randomized;Treatment;;;;;;;;;
['clinical_trials'];False;NCT03454711;[{'type': 'org_study_id', 'id': '35RC17_8949_AddictO', 'source': 'clinical_trials'}, {'type': 'Other Identifier', 'id': '2017-A01269-44', 'source': 'clinical_trials'}];Functional Magnetic Resonance Imaging (fMRI) Exploration of Neurocognitive Processes Involved in Food Addiction (FA) in Obese Patients: Towards New Phenotypic Markers for an Optimized Care Pathway;AddictO;Identification of the cerebral fMRI phenotype of obese patients with FA in cognitive task context based on food choice making;2018-04-26T00:00:00;Actual;Completed;2021-09-08T00:00:00;Actual;2018-02-20T00:00:00;2018-03-05T00:00:00;Interventional;;47.0;Actual;[];0.0;False;No;Rennes University Hospital;['France'];['CHU de Rennes'];2022-11-28;2018.0;2021.0;-65.0;before_start;1231.0;academique;True;Completed;['fr'];;[];Biological;Non-Randomized;Other;;;;;;;;;
['clinical_trials'];False;NCT02528032;[{'type': 'org_study_id', 'id': '35RC14-9767', 'source': 'clinical_trials'}];Revisit the Value of Imaging in Best Using CArdiac Resynchronization Therapy;RICART;Many studies have shown the benefits of cardiac resynchronization therapy (CRT) with biventricular pacing in patients with heart failure with left ventricular dysfunction. CRT restores contraction coordination between different regions of the left ventricle, which yields a significant improvement in LV systolic function, symptoms, exercise tolerance and quality of life. In the longer term, treatment with resynchronization induces a reverse remodeling of the left ventricle and a decrease in mortality and morbidity (hospitalization for heart failure). Nevertheless, even if a majority of patients treated with CRT feel the benefit, some (up to 40% depending on the response criteria of CRT) do not experience significant improvement (nonresponders). Echocardiography and imaging have not so far demonstrated their added value to optimize delivery of CRT. Monocentric promising work on limited numbers of patients, however, were carried out. Meanwhile, equipment for delivering CRT evolves and new probes with four poles stimulation of the left ventricle are now used. The objective of this research is to validate new sequences of ultrasound processing estimating the CRT. These tools are based on usual echocardiographic examination of patients;2015-08-28T00:00:00;;Completed;2018-09-28T00:00:00;Actual;2015-08-14T00:00:00;2015-08-18T00:00:00;Interventional;;80.0;Actual;[];0.0;False;;Rennes University Hospital;['France'];['CHU Pontchaillou'];2022-11-28;2015.0;2018.0;-14.0;before_start;1127.0;academique;True;Completed;['fr'];;[];Other;N/A;Other;;;;;;;;;
['clinical_trials'];False;NCT02492529;[{'type': 'org_study_id', 'id': '2014-A01123-44', 'source': 'clinical_trials'}, {'type': 'Other Identifier', 'id': '35RC14_9777_EPMR-MA', 'source': 'clinical_trials'}];Knowing and Remembering: Cognitive and Neural Influences of Familiarity on Recognition Memory in Early Alzheimer's Disease;EPMR-MA;Unrandomized, unblinded, monocentric comparative Functional Magnetic Resonance Imaging study.;2015-07-21T00:00:00;Actual;Completed;2017-12-31T00:00:00;Actual;2014-11-18T00:00:00;2015-07-03T00:00:00;Interventional;;100.0;Actual;[];0.0;False;;Rennes University Hospital;['France'];['Centre Hospitalier Universitaire'];2022-11-28;2015.0;2017.0;-245.0;before_start;894.0;academique;True;Completed;['fr'];;[];Other;Non-Randomized;Other;;;;;;;;;
['clinical_trials'];False;NCT02470247;[{'type': 'org_study_id', 'id': '35RC14_9899_IPC-Angio Trial', 'source': 'clinical_trials'}, {'type': 'Other Identifier', 'id': '150058B-11', 'source': 'clinical_trials'}, {'type': 'Other Identifier', 'id': '15/07-969', 'source': 'clinical_trials'}, {'type': 'Other Identifier', 'id': '2015-A00076-43', 'source': 'clinical_trials'}];IPC-Angio Trial : Interest of Remote Ischemic Preconditioning for Prevention of Contrast Medium-induced Nephropathy (Post-diagnostic Imaging) in Patients at High Risk of Contrast-induced Nephropathy;IPC-Angio;"Diagnostic imaging for vascular investigations and endovascular procedures frequently require the use of contrast medium. Besides contrast medium-induced hypersensitivity, an acute kidney injury can appear: the contrast-induced nephropathy (NPCI).

NPCI is associated with an increase of patients' morbidity and mortality. One of the conventional methods proposed to limit this NPCI is an oral administration of N-acetylcysteine (NAC) associated with hydration performed 12 hours before and 12 hours after the injection. However, in some patients this method cannot be performed due to a high risk of heart failure although they are generally at high risk of NPCI.

Recently, it has been shown, in a randomized trial, that remote ischemic preconditioning (several cycles of upper-arm ischemia-reperfusion with a pressure cuff inflator) associated with hydratation and NAC reduced the occurrence of NPCI after a coronary angiography as compared with NAC and hydration only. .

We hypothesized that the use of RIPC in patients at high risk of NPCI and who cannot receive NAC and hydratation (e.g. patients with aortic stenosis and eligible for Transcatheter Aortic Valve Implantation (TAVI)) could be promising.";2015-10-06T00:00:00;Actual;Completed;2020-10-31T00:00:00;Actual;2015-06-05T00:00:00;2015-06-09T00:00:00;Interventional;;26.0;Actual;[];0.0;False;;Rennes University Hospital;['France'];['Rennes University Hospital'];2022-11-28;2015.0;2020.0;-123.0;before_start;1852.0;academique;True;Completed;['fr'];;[];Other;Randomized;Prevention;;;;;;;;;
['clinical_trials'];False;NCT02465970;[{'type': 'org_study_id', 'id': '35RC14_9808', 'source': 'clinical_trials'}];BRAINSTIM : Effects of Transcranial Direct Current Stimulation (TDCS) in Drug-resistant Partial Epilepsy;BRAINSTIM;"Drug-resistant partial epilepsy has a heavy impact on quality of life and sometimes on life expectancy itself. Only a minority of patients may benefit from a curative epilepsy surgery. Neurostimulation, which can be an effective add-on treatment, is currently mainly represented by vagus nervus stimulation. Transcranial direct current stimulation, a non -invasive technique already used in other areas of neurology, may be efficient on some partial epilepsies, in particular through the individual configuration of stimulation, made possible by recent technological advances.

Main goal : To study the effect of transcranial electrical stimulation on the frequency of seizures in patients with drug-resistant partial epilepsy.

Hypothesis : Reduction of 50% or more in the frequency of occurrence of seizures within 24 hours following an individually configured TDCS session: responders in real TDCS vs placebo stimulation.";2015-11-13T00:00:00;Actual;Completed;2018-12-28T00:00:00;Actual;2015-06-01T00:00:00;2015-06-08T00:00:00;Interventional;;5.0;Actual;[];0.0;False;;Rennes University Hospital;['France'];['Service de Neurologie'];2022-11-28;2015.0;2018.0;-165.0;before_start;1141.0;academique;True;Completed;['fr'];;[];Device;Randomized;Treatment;;;;;;;;;
