all_sources;has_results;NCTId;other_ids;title;acronym;summary;study_start_date;study_start_date_type;status;study_completion_date;study_completion_date_type;study_first_submit_date;study_first_submit_qc_date;study_type;time_perspective;enrollment_count;enrollment_type;references;has_publications_result;has_results_or_publications;ipd_sharing;lead_sponsor;location_country;location_facility;snapshot_date;study_start_year;study_completion_year;delay_submission_start;submission_temporality;delay_start_completion;lead_sponsor_type;french_location_only;status_simplified;bso_country;has_publication_oa;publication_access;intervention_type;design_allocation;primary_purpose;eudraCT;publications_result;results_first_submit_date;results_first_submit_qc_date;first_results_or_publication_date;delay_first_results_completion;ipd_sharing_description;WHO;ISRCTN
['clinical_trials', 'euctr'];False;NCT02400047;[{'type': 'org_study_id', 'id': '35RC14_9853_DEXA OP', 'source': 'clinical_trials'}, {'type': 'EudraCT Number', 'id': '2014-005026-35', 'source': 'clinical_trials'}, {'type': 'Other Identifier', 'id': '141557A-32', 'source': 'clinical_trials'}, {'type': 'org_study_id', 'id': '35RC14_9853_DEXA-OP', 'source': 'euctr'}];Dexamethasone, Can it Replace Ketoprofen in the Strategy of Intraoperative Multimodal Analgesia in Paediatric Surgery ? A Prospective Randomized Double-blinded Study. DEXA OP;DEXA OP;"Postoperative pain and nausea-vomiting (PONV) are the first causes of failure in ambulatory care in pediatric surgery. Actually, the paracetamol/ketoprofen combination in intraoperative care is recommended for effective postoperative analgesia in children. However, intravenous ketoprofen doesn't have the marketing authorization for use in children less than 15 years old and its use is mainly justified by the absence of therapeutic alternatives. Recently, findings from published studies suggest that dexamethasone (DXM), which is actually recommended to prevent PONV for children ""at risk"", at a dose of 0.1mg/kg, would have analgesic properties above 0.15 mg/kg comparable to non-steroidal anti-inflammatories (NSAI).

Main objective :

To examine the effects of intraoperative DXM (0.2mg/kg and 0.4mg/kg) on the intensity of postoperative pain in the post-anaesthetic care unit (PACU) compared to ketoprofen (1mg/kg).

Secondary objectives :

To examine the effects of intraoperative DXM (0.2mg/kg and 0.4mg/kg) compared to ketoprofen (1mg/kg) on the anesthesia emergence delirium, the intensity of postoperative pain, the consumption of rescue analgesics and the side effects in the first 24 hours after surgery.";2015-06-03T00:00:00;Actual;Completed;2019-07-18T00:00:00;Actual;2015-03-23T00:00:00;2015-03-25T00:00:00;Interventional;;580.0;Actual;[];0.0;False;;Rennes University Hospital;['France'];['Rennes University Hospital'];2022-11-28;2015.0;2019.0;-72.0;before_start;1506.0;academique;True;Completed;['fr'];;[];Drug;Randomized;Treatment;2014-005026-35;;;;;;;;
['clinical_trials'];False;NCT02398474;[{'type': 'org_study_id', 'id': '2014-003383-21', 'source': 'clinical_trials'}];Intérêt du TFP (Transversalis Fascia Plane) Bloc échoguidé Pour l'analgésie du prélèvement Osseux de crête Iliaque;TFP;"Iliac crest bone graft harvest is associated with acute pain that can lead to chronic postoperative pain. Local anesthetic infiltration and regional anesthesia could be of interest to reduce opioid consumption during and after surgery, reduce hyperalgesia and the associated risk of chronic postoperative pain. In this surgery, local anesthetic infiltration of the iliac crest is associated with a pain reduction compare with placebo.

Some studies have shown the benefit of a TAP (transversus abdominal block) for postoperative analgesia after iliac crest bone graft harvest. The TFP block (transversalis fascia plane block) has been recently described. Considering the nerves trajectories, the TFP block is probably anatomically the most appropriate block for analgesia after iliac crest bone graft harvest.

The aim of this study is therefore to assess the benefit of an ultrasound TFP block for analgesia after iliac crest bone graft harvest compare with local anesthetic infiltration Design is prospective, randomized, double blind, controlled study";2015-05-12T00:00:00;Actual;Completed;2018-12-28T00:00:00;Actual;2015-03-20T00:00:00;2015-03-20T00:00:00;Interventional;;46.0;Actual;[];0.0;False;;Rennes University Hospital;['France'];['CHU de Rennes'];2022-11-28;2015.0;2018.0;-53.0;before_start;1326.0;academique;True;Completed;['fr'];;[];Drug;Randomized;Treatment;;;;;;;;;
['clinical_trials'];False;NCT02357407;[{'type': 'org_study_id', 'id': '2014-004193-4', 'source': 'clinical_trials'}, {'type': 'Other Identifier', 'id': '35RC14_9179', 'source': 'clinical_trials'}];Development of an Adjustment Assistance Tool Dosage of Fluoroquinolones in a Population Pharmacokinetic Model;FLUO-POP;"Fluoroquinolones (FQ) are among pivotal antibiotic treatments in difficult-to-treat infections. Their efficacy has been shown to be linked to the ratio area under the curve (AUC) of their plasma concentrations over the minimum inhibitory concentration (MIC) of the bacteria treated. Eventually, Forrest et al., reported in gram-negative infections that an AUC/MIC above 125 conducted to a 80 to 90% clinical success whereas success decrease to 30 to 40% in patients with an AUC/MIC below this threshold. These results have been reproduced recently by Zelenitsky et al. in intensive care unit (ICU) patients with threshold similar to the one obtained by Forrest et al. Lastly, elevated concentrations of FQ should be related with the onset of adverse events. Thus, therapeutic drug monitoring (TDM) of FQ appears of potential interest, particularly in case of severe infections (intensive care unit (ICU) patients) or complicated and cost-related infections (osteoarticular infected (OAI) patients), with an increasing level of evidence of its use.

However, FQ TDM requires access to the full AUC of the drug with the need of many samples drawn to patients. This appears to be irreconcilable with clinical practice but can be achieved using population pharmacokinetic (PkPop) modelling. PkPop allows estimating pharmacokinetic parameters of the drug by introducing covariates (demographic, biological, clinical…) and modelling inter-individual pharmacokinetic variability. The model created allows then accessing to individual parameters of patients and thus, estimating concentrations and AUC of the FQ. This approach may also be used in clinical practice to determine a limited sampling strategy allowing an adequate estimation of AUC with a minimum of samples.";2015-06-28T00:00:00;Actual;Completed;2016-12-28T00:00:00;Actual;2015-01-16T00:00:00;2015-02-02T00:00:00;Interventional;;31.0;Actual;[];0.0;False;;Rennes University Hospital;['France'];['Rennes University Hospital'];2022-11-28;2015.0;2016.0;-163.0;before_start;549.0;academique;True;Completed;['fr'];;[];Drug;Non-Randomized;Other;;;;;;;;;
['clinical_trials'];False;NCT02350556;[{'type': 'org_study_id', 'id': '2014-A00097-40', 'source': 'clinical_trials'}];Interest of Evaluating the Movement of the Center of Mass in a Dynamic Avoidance Task as the Endpoint of the Dynamic Equilibrium of Hemiplegic Patients;EQHEM;"For several years, the postural disorders assessment in hemiplegic patients was conducted through force plate, using the center of plantar pressure displacement in a static position.

These are widely used in physical therapy both for assessment and rehabilitation of patients with balance disorders.

For hemiplegic patients, an asymmetric distribution support on each foot and an increased surface area of postural sways (more marked on the medio lateral axis) are observed.

These studies, based on the study of plantar pressure ,are not enough to providea full description of the spatio-temporal organization of postural components in hemiplegic patients.

Indeed, postural stabilometric evaluation is based on a simplification of the human skeleton by considering it as a simple inverted pendulum swinging on his ankles.

This simplified model can't be used in dynamic assessment because of the simultaneous contributions of several joints during movement. This restricts its clinical interest because patients are more exposed to imbalances and falls in dynamic situations. Thus, the hip angular movement results in a center plantar pressure displacementwhich is impossible to discriminate from the ankle axis movement using stabilometric signal only.

Thus, it seemed interesting to study another variable valid in dynamic conditions : the displacement of center of mass during a dynamic balancing task. This variable is obtained through 3D motion capture of the different segments of the human body. The dynamic test is a dynamic postural assessment following ball avoidance from three different directions. The center of mass displacement will be compared with a functional test known to be representative of dynamic balance of the individual capacities: The Timed Up and Go test (TUG).

All of this data aims to improve the hemiplegic postural assessment for physical therapy and to help develop new rehabilitative approaches.";2015-03-09T00:00:00;Actual;Completed;2016-11-23T00:00:00;Actual;2015-01-26T00:00:00;2015-01-28T00:00:00;Interventional;;63.0;Actual;[];0.0;False;;Rennes University Hospital;['France'];['CHU Rennes Pontchaillou'];2022-11-28;2015.0;2016.0;-42.0;before_start;625.0;academique;True;Completed;['fr'];;[];Other;Non-Randomized;Other;;;;;;;;;
['clinical_trials'];False;NCT02305771;[{'type': 'org_study_id', 'id': '2014-A01461-46', 'source': 'clinical_trials'}, {'type': 'Other Identifier', 'id': '35RC14_9849_BRAINGRAPH', 'source': 'clinical_trials'}];Contributions From the Analysis of Graphs for Identification of Neural Cliques;BRAINGRAPH;The aim of the study is to demonstrate that our semantic knowledge (elements of our long-term memory and the process we use them) respond to a graphic organisation and gather together following accurate patterns called cliques (neural networks).;2015-02-27T00:00:00;Actual;Completed;2015-11-20T00:00:00;Actual;2014-11-28T00:00:00;2014-12-02T00:00:00;Interventional;;21.0;Actual;[];0.0;False;;Rennes University Hospital;['France'];['Rennes University Hospital'];2022-11-28;2015.0;2015.0;-91.0;before_start;266.0;academique;True;Completed;['fr'];;[];Device;N/A;Other;;;;;;;;;
['clinical_trials'];False;NCT02304874;[{'type': 'org_study_id', 'id': 'LOC/11-03', 'source': 'clinical_trials'}];Evaluation of Body Iron Stores in Overweight Healthy Volunteers;FERNORM;Normal body iron store value in overweight subjects is currently not described in literature. The comparison of this value with body iron levels in patients suffering from dysmetabolic iron overload syndrome (DIOS) could allow to quantify iron overload in this condition. The purpose of the study is to determine iron levels in healthy overweight volunteers, and to compare them to DIOS patients treated with phlebotomy.;2011-07-28T00:00:00;;Completed;2014-08-28T00:00:00;Actual;2014-11-24T00:00:00;2014-11-27T00:00:00;Interventional;;14.0;Actual;[];0.0;False;;Rennes University Hospital;['France'];['CHU Pontchaillou'];2022-11-28;2011.0;2014.0;1215.0;after_completion;1127.0;academique;True;Completed;['fr'];;[];Other;N/A;;;;;;;;;;
['clinical_trials'];False;NCT02149862;[{'type': 'org_study_id', 'id': '2013-A00038-37', 'source': 'clinical_trials'}];FIRBladd - Use of Infrared Spectroscopy in the Diagnosis of Bladder Tumors;FIRBladd;The purpose of this study is too assess infrared spectroscopy ability to discriminate urine of a patient affected by bladder cancer from urine of reference patient.;2014-05-28T00:00:00;;Completed;2015-12-28T00:00:00;Actual;2014-05-13T00:00:00;2014-05-23T00:00:00;Interventional;;137.0;Actual;[];0.0;False;;Rennes University Hospital;['France'];['CHU rennes'];2022-11-28;2014.0;2015.0;-15.0;before_start;579.0;academique;True;Completed;['fr'];;[];Other;Non-Randomized;Diagnostic;;;;;;;;;
['clinical_trials'];False;NCT02140918;[{'type': 'org_study_id', 'id': '2013-004794-27', 'source': 'clinical_trials'}];Hemodynamic and Biological Effects of 3 Increasing Doses of Fludrocortisone in Healthy Volunteers;AFLUCO4;"Fludrocortisone, in association with hydrocortisone, has demonstrated an improvement in survival in septic shock patients with relative adrenal insufficiency. However, the utility of low doses of steroids and in particular of mineralocorticoids in septic shock is still discussed.

The purpose of the investigators study is to investigate the effects of 3 increasing doses of fludrocortisone (100 μg, 200 μg, 400 μg) in order to determine which dose allows the best pressor response to phenylephrine in healthy volunteers, and simultaneously assess their respective hemodynamic and biological effects.";2014-07-01T00:00:00;Actual;Completed;2016-04-20T00:00:00;Actual;2014-05-12T00:00:00;2014-05-14T00:00:00;Interventional;;16.0;Actual;[];0.0;False;;Rennes University Hospital;['France'];['Rennes University Hospital'];2022-11-28;2014.0;2016.0;-50.0;before_start;659.0;academique;True;Completed;['fr'];;[];Drug;Randomized;Basic Science;;;;;;;;;
['clinical_trials'];False;NCT02131909;[{'type': 'org_study_id', 'id': '2013-A01325-40', 'source': 'clinical_trials'}];PC MIROIR : Effects of Mirror Therapy in Children With Hemiplegic Cerebral Palsy;PC MIROIR;"This is a randomized and comparative prospective test, monocentric and controlled (mirror therapy versus bimanual rehabilitation exercises), in single-blind (investigator and occupational therapist "" 1 "" do not know the type of rehabilitation performed).";2014-02-28T00:00:00;Actual;Completed;2017-11-28T00:00:00;Actual;2014-04-28T00:00:00;2014-05-05T00:00:00;Interventional;;33.0;Actual;[];0.0;False;;Rennes University Hospital;['France'];['CHU Rennes'];2022-11-28;2014.0;2017.0;59.0;during_study;1369.0;academique;True;Completed;['fr'];;[];Procedure;Randomized;Other;;;;;;;;;
['clinical_trials'];False;NCT02125110;[{'type': 'org_study_id', 'id': '2013-A01420-45', 'source': 'clinical_trials'}];Effect of Prenatal Exposure to Neurotoxicants on the Developing Brain: an MRI Study;PERINE;This project aims at evaluating the consequences of prenatal exposure to neurotoxicants (solvents, organophosphate pesticides) on the developing brain, in children aged from 10 to 12 years.;2014-04-28T00:00:00;Actual;Completed;2017-10-28T00:00:00;Actual;2014-04-22T00:00:00;2014-04-24T00:00:00;Interventional;;112.0;Actual;[];0.0;False;;Rennes University Hospital;['France'];['CHU Rennes'];2022-11-28;2014.0;2017.0;-6.0;before_start;1279.0;academique;True;Completed;['fr'];;[];Other;Non-Randomized;Other;;;;;;;;;
['clinical_trials'];False;NCT02099214;[{'type': 'org_study_id', 'id': '2013-A01843-42', 'source': 'clinical_trials'}];Estimation of Myocardial Iron Overload by 3 Tesla MRI and Cardiac Functional Consequences in Patients With HFE Hereditary Haemochromatosis. Pilot Study;HEMOCOEUR;"Hereditary haemochromatosis (HHC) is a frequent disease in Brittany (5 to 7‰), responsible first for biological disorder in blood iron parameters and minor clinical disorders, before evolving to potential life-threatening consequences such as diabetes, liver cirrhosis and congestive heart failure.

The improvement of screening and treatments made those severe affections rare enough not to evaluate myocardial iron overload a systematic part of the starting check-up. Nonetheless this myocardial iron overload might have severe implications on cardiac function on a long term basis.

A single trial was conducted on limited number of patients with 1.5 Tesla MRI, which showed a myocardial iron overload (defined by a myocardium T2* value <20ms) in 19% of the subjects.

The main objective of this study is to precisely estimate cardiac iron overload in treatment naive patients with newly diagnosed HFE hereditary haemochromatosis with a 3 Tesla MRI, more sensitive than the 1.5 Tesla one, in order to later appreciate its correlation with cardiac morbidity in HHC.";2014-11-05T00:00:00;Actual;Completed;2017-10-18T00:00:00;Actual;2014-03-21T00:00:00;2014-03-27T00:00:00;Interventional;;66.0;Actual;[];0.0;False;;Rennes University Hospital;['France'];['Rennes University Hospital'];2022-11-28;2014.0;2017.0;-229.0;before_start;1078.0;academique;True;Completed;['fr'];;[];Biological;Non-Randomized;Diagnostic;;;;;;;;;
['clinical_trials'];False;NCT02061488;[{'type': 'org_study_id', 'id': '2013-A01604-41', 'source': 'clinical_trials'}, {'type': 'Other Identifier', 'id': '35RC13_8806_PPA', 'source': 'clinical_trials'}];Prospective, Monocentric, Crossover Randomized Trial, to Assess a New Closed-loop Algorithm in Type 1 Diabetes (Saddle Point Model Predictive Control : SP-MPC);PPA;The purpose of the study is to assess a new closed-loop algorithm in type 1 diabetes (Saddle Point Model Predictive Control : SP-MPC);2014-03-28T00:00:00;;Completed;2014-07-28T00:00:00;Actual;2014-02-11T00:00:00;2014-02-11T00:00:00;Interventional;;10.0;Actual;[];0.0;False;;Rennes University Hospital;['France'];['Rennes University Hospital'];2022-11-28;2014.0;2014.0;-45.0;before_start;122.0;academique;True;Completed;['fr'];;[];Other;Randomized;;;;;;;;;;
['clinical_trials'];False;NCT02041169;[{'type': 'org_study_id', 'id': '35RC13-9907-CLASH', 'source': 'clinical_trials'}, {'type': 'Other Identifier', 'id': '2013-A01381-44', 'source': 'clinical_trials'}, {'type': 'Other Identifier', 'id': '13/34-914', 'source': 'clinical_trials'}];Lower Extremity Peripheral Arterial Disease and Exercise Ischemia: Walking Capacity Variability, Pain Evolution and Pathophysiological Responses. The CLASH Study.;CLASH;"Lower extremity peripheral arterial disease (LEPAD) is a highly prevalent chronic disease. Cardiovascular mortality of LEPAD patients at five years ranges between 18 to 30%. LEPAD is primarily caused by atherosclerosis that induces an inadequate blood flow to meet the tissues demand due to the narrowing of the arteries. An aggravation of the arterial lesions in LEPAD patients induces a worsening of patients' symptoms and a severe limitation of their walking capacity, contributing to an impairment of their quality of life. Despite maintaining a sufficient walking activity is essential for these patients, LEPAD patients lower their physical activity, which worsen the disease and potentially contribute to increase the risk of cardiovascular events and deaths.

In a recent study in LEPAD patients, we showed, from a one hour GPS recording, a high variability of the patients' walking capacity (i.e., walking distances between two stops induced by lower limbs pain). Results suggested that in most patients previous stop duration before each walk was a predictor parameter of this walking variability. Whether there is an optimal or minimal recovery time influencing the walking capacity in LEPAD patients has never been studied.

This study is a prospective, cross-sectional study in exercise pathophysiology.

The main goal is to determine, following a walk that induces ischemia, the influence of the recovery duration on the subsequent walking performance in LEPAD patients.

Secondary goals are :

To determine the nature of the relationship between the recovery duration and subsequent walking performance.
To study the relationship between exercise ischemia, pain evolution and previous recovery duration.
To determine whether the experimental procedure influence the determination of an optimal of minimal recovery duration.
To study the influence of recovery duration on walking capacity from community-based measurement.";2014-09-28T00:00:00;Actual;Completed;2018-09-28T00:00:00;Actual;2014-01-14T00:00:00;2014-01-17T00:00:00;Interventional;;23.0;Actual;[];0.0;False;;Rennes University Hospital;['France'];['Rennes University Hospital'];2022-11-28;2014.0;2018.0;-257.0;before_start;1461.0;academique;True;Completed;['fr'];;[];Other;N/A;Supportive Care;;;;;;;;;
['clinical_trials'];False;NCT01435668;[{'type': 'org_study_id', 'id': 'LOC/11-01 - AURAIA', 'source': 'clinical_trials'}, {'type': 'Other Identifier', 'id': '2011-A00017-34', 'source': 'clinical_trials'}, {'type': 'Other Identifier', 'id': '11/06-795', 'source': 'clinical_trials'}];Impact Evaluation at 3 Months Follow-up of a Brief Motivational Intervention in Reducing Alcohol Consumption Versus Simple Written Advice Only Among Adolescents Aged 16-24 in Pontchaillou Hospital Emergency Department in Rennes, France;AURAIA;"The purpose of this study is to evaluate the effectiveness of a Brief Motivational Intervention (BMI), in reducing alcohol consumption among patients with hazardous or harmful drinking admitted in emergency department (ED). Patients aged 16 to 24 and who tested positive for blood alcohol content (BAC) of 0.5g/l. or above are enrolled.

Patients receive either an information leaflet or an information leaflet plus a referral to a psychologist. BMI is provided by the psychologist. BMI consists in a first face-to-face interview (35-45 minutes) plus a telephone interview, at 1 and 2 months. Minors' parents are also invited to attend the BMI session. If necessary, patients can be referred to relevant care and treatment services for alcohol misuse.

In a simple blind, randomised controlled clinical trial of 280 patients, 140 patients are allocated to the treatment group and 140 to the control group. Randomisation is stratified according to patient's age (16-17 or 18-24). Opaque and sealed randomized envelops are used for randomisation.

Alcohol consumption is measured by self-report at 3 months. The principal criteria used to assess the reduction of alcohol use at 3 months follow-up is the number of alcoholic drinks in the last week. Other events such as ED readmission, quarrels related to alcohol, drinking and driving, sexual intercourse without protection will also be assessed. It is the first clinical trial in France comparing these two interventions among young patients in ED with this design.";2011-09-28T00:00:00;;Completed;2012-12-28T00:00:00;Actual;2011-09-12T00:00:00;2011-09-15T00:00:00;Interventional;;258.0;Actual;[];0.0;False;;Rennes University Hospital;['France'];['Rennes University Hospital'];2022-11-28;2011.0;2012.0;-16.0;before_start;457.0;academique;True;Completed;['fr'];;[];Behavioral;Randomized;Prevention;;;;;;;;;
['clinical_trials'];False;NCT01810965;[{'type': 'org_study_id', 'id': 'ANSM 2012-A01392-41', 'source': 'clinical_trials'}];Impact of Bloodletting on Iron Metabolism in Type 1 Hemochromatosis: Pathophysiological and Clinical Implications. Pilot Study.;SAIFER;"Hemochromatosis type 1 is one of the most frequent genetic disease since the genetic predisposition (homozygosity for the C282Y mutation of the HFE gene) is encountered in about 3/1000 white subjects (5/1000 in Brittany, France).

For the half of these predisposed subjects, the phenotypic expression of the disease needs a treatment. This treatment is based upon repeated bloodletting which is generally considered as simple, safe and effective.

Nevertheless, it is still questioned as regard its physiopathological justification and its clinical implications. Indeed, bloodletting could cause an increase of non-transferrin bound iron (NTBI) particularly for its reactive form called labile plasma iron (LPI) This adverse physiopathological effect could have clinical consequences and could be linked with articular consequences which can be aggravated by the treatment.";2013-06-03T00:00:00;Actual;Completed;2019-04-19T00:00:00;Actual;2013-03-12T00:00:00;2013-03-12T00:00:00;Interventional;;6.0;Actual;[];0.0;False;;Rennes University Hospital;['France'];['CHU Pontchaillou'];2022-11-28;2013.0;2019.0;-83.0;before_start;2146.0;academique;True;Completed;['fr'];;[];Procedure;N/A;Treatment;;;;;;;;;
['clinical_trials'];False;NCT01045525;[{'type': 'org_study_id', 'id': 'EUDRACT 2009-A00831-56', 'source': 'clinical_trials'}, {'type': 'Other Identifier', 'id': 'PHRC / 09-02', 'source': 'clinical_trials'}];Prospective Randomized Study Comparing the Effect of Phlebotomy and Lifestyle and Diet Advices vs Lifestyle and Diet Advices Only on Glycemia in Patients With Dysmetabolic Liversiderosis;SAIGNEES;"Insulin resistance-associated hepatic iron overload (IR-HIO), also defined as dysmetabolic iron overload syndrome or dysmetabolic liversiderosis, is a common cause or iron overload in France, mainly in middle-age patients with increased serum ferritin levels associated with normal serum transferrin saturation, and normal serum iron concentration in the absence of other known cause of increased serum ferritin levels.

Treatment includes a combination of dietary measures and physical activity to correct metabolic disorders. Phlebotomies seem to be beneficial when serum ferritin level is high.

This study aims at comparing the effect of iron depletion (by phlebotomy) plus lifestyle and diet advices versus lifestyle and diet advices alone on blood glucose level and insulin sensitivity in subjects with IR-HIO in order to assess the benefits of phlebotomies on the reduction of risk of diabetes and cardiovascular associated complications.";2010-01-28T00:00:00;;Completed;2015-12-28T00:00:00;Actual;2010-01-08T00:00:00;2010-01-08T00:00:00;Interventional;;274.0;Actual;[];0.0;False;;Rennes University Hospital;['France'];['Saint-Malo Hospital', 'La Roche Sur Yon Hospital', 'Service des maladies du foie - Hôpital Pontchaillou', 'Lorient Hospital', 'Clermont-Ferrand University Hospital'];2022-11-28;2010.0;2015.0;-20.0;before_start;2160.0;academique;True;Completed;['fr'];;[];Procedure;Randomized;Treatment;;;;;;;;;
