all_sources;has_results;NCTId;other_ids;title;acronym;summary;study_start_date;study_start_date_type;status;study_completion_date;study_completion_date_type;study_first_submit_date;study_first_submit_qc_date;study_type;time_perspective;enrollment_count;enrollment_type;references;has_publications_result;has_results_or_publications;ipd_sharing;lead_sponsor;location_country;location_facility;snapshot_date;study_start_year;study_completion_year;delay_submission_start;submission_temporality;delay_start_completion;lead_sponsor_type;french_location_only;status_simplified;bso_country;has_publication_oa;publication_access;intervention_type;design_allocation;primary_purpose;eudraCT;publications_result;results_first_submit_date;results_first_submit_qc_date;first_results_or_publication_date;delay_first_results_completion;ipd_sharing_description;WHO;ISRCTN
['clinical_trials'];False;NCT03250936;[{'type': 'org_study_id', 'id': '35RC16_3058', 'source': 'clinical_trials'}];Descriptive Study of Trampoline Accidents in the Pediatric Emergency Department of Rennes;TRAUMPO;The aim of this study is to compare trauma related to others sport to trauma due to trampoline in pediatric emergencies of Rennes.;2016-12-06T00:00:00;Actual;Completed;2017-01-31T00:00:00;Actual;2017-08-11T00:00:00;2017-08-11T00:00:00;Observational;Prospective;4000.0;Actual;[];0.0;False;;Rennes University Hospital;['France'];['Pediatric and orthopedic surgery division'];2022-11-28;2016.0;2017.0;248.0;after_completion;56.0;academique;True;Completed;['fr'];;[];;;;;;;;;;;;
['clinical_trials'];False;NCT03250884;[{'type': 'org_study_id', 'id': '35RC16_3038', 'source': 'clinical_trials'}];Evaluation of the Performance of a Rapid Pregnancy Diagnostic Test.;;The aim of the study is to evaluate the effectiveness of a rapid pregnancy diagnostic test to improve the medical care of patients in emergency room.;2016-08-30T00:00:00;Actual;Completed;2017-12-28T00:00:00;Actual;2017-08-11T00:00:00;2017-08-11T00:00:00;Observational;Prospective;200.0;Actual;[];0.0;False;;Rennes University Hospital;['France'];['Rennes university hospital'];2022-11-28;2016.0;2017.0;346.0;during_study;485.0;academique;True;Completed;['fr'];;[];;;;;;;;;;;;
['clinical_trials'];False;NCT03249467;[{'type': 'org_study_id', 'id': '35RC16_3030_HAQ-II', 'source': 'clinical_trials'}];Validation of the French Version of the Health Assessment Questionnaire II (HAQ-II) for Rheumatoid Arthritis;HAQ-II;The purpose of the study is to develop a validated French version of the HAQ-II questionnaire for rheumatoid arthritis.;2015-10-17T00:00:00;Actual;Completed;2016-07-28T00:00:00;Actual;2017-08-10T00:00:00;2017-08-10T00:00:00;Observational;Prospective;129.0;Actual;[];0.0;False;;Rennes University Hospital;['France'];['CHU de Rennes'];2022-11-28;2015.0;2016.0;663.0;after_completion;285.0;academique;True;Completed;['fr'];;[];;;;;;;;;;;;
['clinical_trials'];False;NCT03112616;[{'type': 'org_study_id', 'id': '35RC16_3049-VIBR-HEMI', 'source': 'clinical_trials'}];The Long-lasting Effects of Repetitive Neck Muscle Vibrations on Postural Disturbances in Standing Position and on Spatial Frame Reference in Chronic Stroke Patients;VIBR-HEMI;One of the causes of disability in patients suffering from a stroke is postural imbalance. Sensory stimulation improves the postural symmetry of the subject transitorily and they are thought to have an effect on the spatial frame of reference through a sensory recalibration. Studies have shown that sensory stimulation by vibration of neck muscles have an immediate effect on static balance and when walking. The objective of this preliminary study is to test the long-lasting effects of repetitive neck muscle vibrations on postural disturbances in standing position and on spatial frame reference in chronic patients.;2016-02-15T00:00:00;Actual;Completed;2017-04-18T00:00:00;Actual;2016-08-09T00:00:00;2017-04-07T00:00:00;Observational;Prospective;39.0;Actual;[];0.0;False;No;Rennes University Hospital;['France'];['CHU Rennes - Pontchaillou Hospital'];2022-11-28;2016.0;2017.0;176.0;during_study;428.0;academique;True;Completed;['fr'];;[];Other;;;;;;;;;;;
['clinical_trials'];False;NCT02881268;[{'type': 'org_study_id', 'id': '35RC15_9903_IMPRIM', 'source': 'clinical_trials'}];Study of Immunosuppression Biomarkers Acquired in Patients Hospitalized in Intensive Care Unit;IMPRIM;Open-label, non-randomized, prospective, single center, observational, translational study;2016-01-19T00:00:00;Actual;Completed;2021-01-14T00:00:00;Actual;2016-08-18T00:00:00;2016-08-23T00:00:00;Observational;Prospective;44.0;Actual;[];0.0;False;No;Rennes University Hospital;['France'];['CHU de Rennes'];2022-11-28;2016.0;2021.0;212.0;during_study;1822.0;academique;True;Completed;['fr'];;[];Other;;;;;;;;;;;
['clinical_trials'];False;NCT02878122;[{'type': 'org_study_id', 'id': '35RC15_3007_FaCliBioCCo', 'source': 'clinical_trials'}];Study of Predictive Factors of Chemoresistance in Ovarian Cancer;FaCliBioCCo;Epithelial ovarian cancer (EOC) has a poor prognosis. EOC management requires debulking surgery and chemotherapy based on taxol and carboplatine. Initial response is often good, but most often a recurrence occurred in the first 18 months. Early recurrence signs chemoresistance and palliative treatment. The study of predictive clinical or biological factors is required to adapt therapeutic and develop new treatments.;2015-03-28T00:00:00;;Completed;2020-03-28T00:00:00;Actual;2016-08-22T00:00:00;2016-08-24T00:00:00;Observational;Retrospective;13.0;Actual;[];0.0;False;No;Rennes University Hospital;['France'];['LAVOUE'];2022-11-28;2015.0;2020.0;513.0;during_study;1827.0;academique;True;Completed;['fr'];;[];Procedure;;;;;;;;;;;
['clinical_trials'];False;NCT02877628;[{'type': 'org_study_id', 'id': '35RC13_8962_OPTILTH', 'source': 'clinical_trials'}];Immunosuppressive Therapy Optimization: Development of a Population Pharmacokinetic-pharmacodynamic (PK-PD) Model in Liver Transplantation;OPTILTH;Prospective, non-randomized, open Pharmacokinetic-Pharmacogenetic-Pharmacodynamic monocentric study. Donor and recipient CYP3A5 genotype and recipient ABCB1 will not be communicate to clinicians or patients during the study.;2015-10-31T00:00:00;Actual;Completed;2018-12-28T00:00:00;Actual;2016-08-16T00:00:00;2016-08-19T00:00:00;Observational;Prospective;110.0;Actual;[];0.0;False;;Rennes University Hospital;['France'];['CHU de Rennes'];2022-11-28;2015.0;2018.0;290.0;during_study;1154.0;academique;True;Completed;['fr'];;[];Other;;;;;;;;;;;
['clinical_trials'];False;NCT02873117;[{'type': 'org_study_id', 'id': '35RC13_8911_CANARI', 'source': 'clinical_trials'}];Evaluation of the Potential Association Between 5α-reductase Inhibitors Prescription and Occurrence of High Grade Prostate Cancers;CANARI;This is a multicenter, cohort study based on medico-administrative data from pathology laboratory registries and drug reimbursement files (CNAM-TS).;2014-12-28T00:00:00;;Completed;2016-12-31T00:00:00;Actual;2016-08-16T00:00:00;2016-08-18T00:00:00;Observational;Retrospective;5154.0;Actual;[];0.0;False;;Rennes University Hospital;['France'];['CHU de Rennes'];2022-11-28;2014.0;2016.0;597.0;during_study;734.0;academique;True;Completed;['fr'];;[];Other;;;;;;;;;;;
['clinical_trials'];False;NCT02860884;[{'type': 'org_study_id', 'id': '35RC13_8989', 'source': 'clinical_trials'}];Using Infrared Spectroscopy for Diagnosis Severity of Nonalcoholic Fatty Liver Disease;NASH;The main objective of this study is to evaluate the ability of infrared spectroscopy to discriminate simple hepatic steatosis from NASH;2014-08-28T00:00:00;;Completed;2015-10-28T00:00:00;Actual;2016-07-26T00:00:00;2016-08-04T00:00:00;Observational;Retrospective;136.0;Actual;[];0.0;False;No;Rennes University Hospital;['France'];['Centre hospitalier universitaire de Rennes'];2022-11-28;2014.0;2015.0;698.0;after_completion;426.0;academique;True;Completed;['fr'];;[];Other;;;;;;;;;;;
['clinical_trials'];False;NCT02860871;[{'type': 'org_study_id', 'id': '35RC13_8815', 'source': 'clinical_trials'}];Use of Infrared Spectroscopy in Septic Arthritis Diagnosis;SynoFAST;The main objective of this study is to assess the ability of Fiber-optic Evanescent Wave Spectroscopy (FEWS) to discriminate synovial fluids samples of septic arthritis patients from other causes of joint effusion by analyzing ex vivo joint fluid samples collected during routine clinical care.;2014-06-28T00:00:00;;Completed;2016-12-28T00:00:00;Actual;2016-07-25T00:00:00;2016-08-04T00:00:00;Observational;Prospective;611.0;Actual;"[{'ReferencePMID': '32885254', 'ReferenceType': 'derived', 'ReferenceCitation': 'Albert JD, Le Corvec M, Berthoud O, David C, Guennoc X, Hoppe E, Jousse-Joulin S, Le Goff B, Tariel H, Sire O, Jolivet-Gougeon A, Coiffier G, Loréal O. Ruling out septic arthritis risk in a few minutes using mid-infrared spectroscopy in synovial fluids. Rheumatology (Oxford). 2021 Mar 2;60(3):1158-1165. doi: 10.1093/rheumatology/keaa373.', 'doi': '10.1093/rheumatology/keaa373', 'source': 'clinical_trials'}]";1.0;True;No;Rennes University Hospital;['France'];['CHU de RENNES'];2022-11-28;2014.0;2016.0;758.0;during_study;914.0;academique;True;Completed;['fr'];;[];Other;;;;10.1093/rheumatology/keaa373;;;;;;;
['clinical_trials'];False;NCT02854150;[{'type': 'org_study_id', 'id': '35RC14_9736', 'source': 'clinical_trials'}];Improving Genetic Counseling for Patients With Spina Bifida Using Next Generation Sequencing;EXOSPINA;The main objective is to improve genetic counseling in patients with Spina Bifida, by the characterization of variants in new genes using high throughput sequencing either on a panel of targeted genes or on exome in families.;2015-09-28T00:00:00;;Completed;2016-06-30T00:00:00;Actual;2016-07-26T00:00:00;2016-08-02T00:00:00;Observational;Retrospective;106.0;Actual;[];0.0;False;;Rennes University Hospital;['France'];['Centre hospitalier universitaire de RENNES'];2022-11-28;2015.0;2016.0;302.0;after_completion;276.0;academique;True;Completed;['fr'];;[];Genetic;;;;;;;;;;;
['clinical_trials'];False;NCT02852343;[{'type': 'org_study_id', 'id': '35RC14_9878', 'source': 'clinical_trials'}];Etude de Concordance Entre la Technique OSNA et Les Techniques Classiques Pour la Recherche de métastases Ganglionnaires Des Cancers Des VADS;OSNA-ORL;The investigators main objective is to show that OSNA technique is as accurate as pathological analysis (frozen section / HE staining and immunochemistry) to detect occult lymph node metastasis (micro and macrometastasis).;2015-01-05T00:00:00;Actual;Completed;2016-12-21T00:00:00;Actual;2016-07-19T00:00:00;2016-07-28T00:00:00;Observational;Prospective;26.0;Actual;"[{'ReferencePMID': '32004908', 'ReferenceType': 'derived', 'ReferenceCitation': 'Peigné L, Godey F, Le Gallo M, Le Gall F, Fautrel A, Morcet J, Jégoux F. One-step nucleic acid amplification for detecting lymph node metastasis of head and neck squamous cell carcinoma. Oral Oncol. 2020 Mar;102:104553. doi: 10.1016/j.oraloncology.2019.104553. Epub 2020 Jan 28.', 'doi': '10.1016/j.oraloncology.2019.104553', 'source': 'clinical_trials'}]";1.0;True;;Rennes University Hospital;['France'];['Centre hospitalier universitaire de Rennes'];2022-11-28;2015.0;2016.0;561.0;during_study;716.0;academique;True;Completed;['fr'];;[];;;;;10.1016/j.oraloncology.2019.104553;;;;;;;
['clinical_trials'];False;NCT02852317;[{'type': 'org_study_id', 'id': '35RC14_8805', 'source': 'clinical_trials'}];Urinary Markers of Detrusor Overactivity in Spina Bifida Patients;BUHD-SPINA;The purpose of this study is to assess diagnostic performance of urinary markers of detrusor overactivity (Nerve Growth Factor (NGF), Brain-Derived Neurotrophic Factor (BDNF), adenosine triphosphate (ATP), Prostaglandine E2) in detected high pressure bladder un spina bifida patients.;2015-03-16T00:00:00;Actual;Completed;2017-07-17T00:00:00;Actual;2016-07-19T00:00:00;2016-08-01T00:00:00;Observational;Prospective;134.0;Actual;[];0.0;False;;Rennes University Hospital;['France'];['Centre hospitalier universitaire de Rennes'];2022-11-28;2015.0;2017.0;491.0;during_study;854.0;academique;True;Completed;['fr'];;[];;;;;;;;;;;;
['clinical_trials'];False;NCT03402958;[{'type': 'org_study_id', 'id': '35RC17_309_GEOFRAGE', 'source': 'clinical_trials'}];General Practitioner's Place in the Treatment of Fracture Osteoporosis in the Elderly;GEOFRAGE;Osteoporosis is a major public health problem. Its screening and its treatment remain largely insufficient while therapies have demonstrated their effectiveness. In the event of a severe fracture, the update of the 2016/2017 recommendations, prepared by the Research and Information Group on Osteoporosis and the French Rheumatology Society, concerning osteoporosis recommends a specific treatment with bisphosphonates as first-line treatment, without bone densitometry, regardless of age. The frequency of prescribing anti-osteoporotic treatment as an outpatient after a fracture of the upper extremity of the femur is very low (2% to 21% according to the studies). The main factors associated with non-prescription found are co-morbidities (charlson score> 6), dementia, obesity (BMI> 30), chronic alcoholism, male sex, polypharmacy> 4, age. Conversely, the factors associated with prescribing are recurrent falls (> 2 / year), a history of osteoporotic fracture, an Iso Resource Group> 3, female sex, and corticosteroid therapy.;2018-03-28T00:00:00;Actual;Completed;2018-03-28T00:00:00;Actual;2018-01-10T00:00:00;2018-01-17T00:00:00;Observational;Retrospective;160.0;Actual;[];0.0;False;;Rennes University Hospital;['France'];['Hospital Center of Saint-Malo'];2022-11-28;2018.0;2018.0;-77.0;before_start;0.0;academique;True;Completed;['fr'];;[];;;;;;;;;;;;
['clinical_trials'];False;NCT03382028;[{'type': 'org_study_id', 'id': '35RC16_3061-DENEBO1', 'source': 'clinical_trials'}, {'type': 'Other Identifier', 'id': '2016-A01975-46', 'source': 'clinical_trials'}];Development of Child With Equinus Deformity Idiopathic;DENEBO1;"Identification and characterization of the link between psychomotor development and the appearance of associated signs in children with ""Equinus Deformity "" considered isolated at birth.";2017-06-01T00:00:00;Actual;Completed;2017-08-31T00:00:00;Actual;2017-11-16T00:00:00;2017-12-18T00:00:00;Observational;Retrospective;112.0;Actual;[];0.0;False;No;Rennes University Hospital;['France'];['Rennes University Hospital'];2022-11-28;2017.0;2017.0;168.0;after_completion;91.0;academique;True;Completed;['fr'];;[];;;;;;;;;;;;
['clinical_trials'];False;NCT03362125;[{'type': 'org_study_id', 'id': '35RC15_3022 BRONCHOLITE', 'source': 'clinical_trials'}];Bronchiolitis: Evaluation of Wang's Score as a Predictor of the Duration of Oxygen Therapy in Bronchiolitis;;Evaluation of Wang's score as a predictor of the duration of oxygen therapy in bronchiolitis;2015-10-01T00:00:00;Actual;Completed;2016-02-15T00:00:00;Actual;2017-11-15T00:00:00;2017-11-28T00:00:00;Observational;Prospective;105.0;Actual;[];0.0;False;No;Rennes University Hospital;['France'];['Rennes University Hospital'];2022-11-28;2015.0;2016.0;776.0;after_completion;137.0;academique;True;Completed;['fr'];;[];;;;;;;;;;;;
['clinical_trials'];False;NCT03356548;[{'type': 'org_study_id', 'id': '35RC17_3067_HEMOSAT', 'source': 'clinical_trials'}];Study of the Association Between Transferrin Saturation and Asthenia in Hemochromatosis;HEMOSAT;Observational study.;2017-04-10T00:00:00;Actual;Completed;2019-04-09T00:00:00;Actual;2017-11-16T00:00:00;2017-11-28T00:00:00;Observational;Prospective;260.0;Actual;[];0.0;False;;Rennes University Hospital;['France'];['Rennes University Hospital'];2022-11-28;2017.0;2019.0;220.0;during_study;729.0;academique;True;Completed;['fr'];;[];;;;;;;;;;;;
['clinical_trials'];False;NCT03356522;[{'type': 'org_study_id', 'id': '35RC16_3029_TRIFIR', 'source': 'clinical_trials'}];TRIFIR : Study of Trabecular Bone Score (TBS) as a Fracture Risk Factor in Chronic Renal Failure;TRIFIR;Observational study;2016-02-01T00:00:00;Actual;Completed;2017-04-30T00:00:00;Actual;2017-11-16T00:00:00;2017-11-28T00:00:00;Observational;Prospective;206.0;Actual;[];0.0;False;;Rennes University Hospital;['France'];['Rennes University Hospital'];2022-11-28;2016.0;2017.0;654.0;after_completion;454.0;academique;True;Completed;['fr'];;[];;;;;;;;;;;;
['clinical_trials'];False;NCT02297958;[{'type': 'org_study_id', 'id': '2014-A01041-46', 'source': 'clinical_trials'}];Impact of Fas/FasL in Chemotherapy Response in Epithelial Ovarian Carcinoma;IFFaLCCO;Ovarian carcinoma has poor prognosis and new therapeutic strategies are required. Many patients with ovarian carcinoma showed resistance to chemotherapy. Cleaved FasL is known for induced atypical response when is binding to Fas such as avoiding apoptosis and inducing cell motility.;2015-01-15T00:00:00;Actual;Completed;2019-07-27T00:00:00;Actual;2014-11-19T00:00:00;2014-11-20T00:00:00;Observational;Prospective;28.0;Actual;[];0.0;False;;Rennes University Hospital;['France'];['Service de Gynécologie'];2022-11-28;2015.0;2019.0;-57.0;before_start;1654.0;academique;True;Completed;['fr'];;[];;;;;;;;;;;;
['clinical_trials'];False;NCT01660776;[{'type': 'org_study_id', 'id': '2011-A01163-38', 'source': 'clinical_trials'}, {'type': 'Other Identifier', 'id': 'B111181-40', 'source': 'clinical_trials'}, {'type': 'Other Identifier', 'id': '11/32-821', 'source': 'clinical_trials'}];BMS_PD-L1_onco : Assessment of the PD-L1 Protein as a Biomarker in Oncology and Hematology;BMS_PD-L1;"Diffuse large B-cell lymphomas (DLBCLs) represent 25 to 30% of adult non-Hodgkin lymphomas in western countries. DLBCLs are aggressive cancer but potentially curable with multi-agent chemotherapy. Whereas R-CHOP regimen has led to a marked improvement in survival, this disease remains a biologically heterogeneous entity. New therapeutic strategies are required including identification of patients' subgroups with different prognostic.

This project is based on BMS_LyTrans and Goelams 075 clinical trial. A study of whole blood transcriptome in 75 DLBCL patients and in 87 controls showed that PD-L1 (CD274) gene was overexpressed in DLBCL patients. Preliminary results demonstrated that PD-L1 is detected in plasma of DLBCL patients with a significantly higher concentration than in controls. This protein was selected as a potential biomarker because of its established role in anti-tumoral immunity. Interaction between PD-L1 and its receptor PD-1 is known to inhibit activation of immune responses by inducing T-lymphocytes anergy and/or apoptosis. Moreover, a direct involvement of PD-L1 in the protection of cancer cells from lysis by activated T lymphocytes has been demonstrated. PD-L1 expression has been described in several solid tumours, including ovary cancer, breast cancer, colon cancer, renal cell carcinoma, non-small cell lung carcinoma and in hematological malignancies such as T-NHL, MM and Hodgkin's lymphoma. Furthermore the expression of PD-L1 by tumour cells is associated with poor prognosis. The blockade of PD-L1/PD-1 axis may represent a novel therapeutic approach in aggressive cancers. These first results incite to identify the cells releasing soluble PD-L1 and to investigate its role in the anti-tumoral immunity in DLBCL patients.

The aim of this study is to identify cells producing soluble PD-L1 in DLBCL patients at diagnosis in comparison to others tumours known to express PD-L1 (metastatic breast cancer, Hodgkin's lymphoma, non-small cell lung cancer).";2012-06-07T00:00:00;Actual;Completed;2019-10-02T00:00:00;Actual;2012-07-31T00:00:00;2012-08-06T00:00:00;Observational;Prospective;105.0;Actual;[];0.0;False;;Rennes University Hospital;['France'];['Rennes EFS', 'Institut Paoli Calmette', 'Rennes University Hospital', 'Montpellier University Hospital'];2022-11-28;2012.0;2019.0;54.0;during_study;2673.0;academique;True;Completed;['fr'];;[];;;;;;;;;;;;
['clinical_trials'];False;NCT03261583;[{'type': 'org_study_id', 'id': '35RC16_3051_CARMATS', 'source': 'clinical_trials'}];Impact of Preoperative Martial Deficiency on the Level of Blood Transfusion in Programmed Cardiac Surgery (CARMATS);CARMATS;Observational study.;2016-11-14T00:00:00;Actual;Completed;2018-01-15T00:00:00;Actual;2017-08-23T00:00:00;2017-08-23T00:00:00;Observational;Prospective;444.0;Actual;[];0.0;False;;Rennes University Hospital;['France'];['Rennes University Hospital', 'Brest University Hospital'];2022-11-28;2016.0;2018.0;282.0;during_study;427.0;academique;True;Completed;['fr'];;[];Other;;;;;;;;;;;
['clinical_trials'];False;NCT02333097;[{'type': 'org_study_id', 'id': '2014-A01528-39', 'source': 'clinical_trials'}];Prospective Study for Diagnosis Utility of Array-CGH Screening in Case of Non Syndromic Congenital Heart Defect in Prenatal Diagnosis (CAPA);CAPA;"Comparative genomic hybridization (CGH)-based microarrays are now often used during pregnancy in case of fetal polymalformation in order to assess significant genomic alterations. However, it is not clear whether array-CGH provide a diagnostic utility in case of isolated congenital heart defect.

This is the first prospective study aiming at defining the right chromosomal screening when a fetal isolated congenital heart defect is identified by ultrasound.";2015-01-28T00:00:00;;Completed;2018-12-28T00:00:00;Actual;2014-12-29T00:00:00;2015-01-05T00:00:00;Observational;Prospective;78.0;Actual;[];0.0;False;;Rennes University Hospital;['France'];['St Brieuc University Hospital', 'Rennes University Hospital'];2022-11-28;2015.0;2018.0;-30.0;before_start;1430.0;academique;True;Completed;['fr'];;[];;;;;;;;;;;;
['clinical_trials'];False;NCT01891214;[{'type': 'org_study_id', 'id': '2013-A00144-41', 'source': 'clinical_trials'}, {'type': 'Other Identifier', 'id': 'LOC/12-17 Bouguen F-IBDQ', 'source': 'clinical_trials'}];Validation of the French Version of the Inflammatory Bowel Disease Questionnaire (IBDQ) for Ulcerative Colitis and Crohn's Disease;F-IBDQ;The purpose of the study is to develop a validated French version of the IBDQ in a cohort of patients suffering from Inflammatory bowel diseases, namely Crohn's disease and Ulcerative Colitis.;2013-12-28T00:00:00;Actual;Completed;2017-01-28T00:00:00;Actual;2013-06-17T00:00:00;2013-06-27T00:00:00;Observational;Prospective;100.0;Actual;[];0.0;False;;Rennes University Hospital;['France'];"[""Service des Maladies de l'Appareil Digestif, Hôpital de Pontchaillou, 2 rue Henri Le Guilloux"", 'CHRU de Nancy']";2022-11-28;2013.0;2017.0;-194.0;before_start;1127.0;academique;True;Completed;['fr'];;[];Other;;;;;;;;;;;
['clinical_trials'];False;NCT01826500;[{'type': 'org_study_id', 'id': 'LOC/12-16 - VARITI-5', 'source': 'clinical_trials'}, {'type': 'Other Identifier', 'id': '2012-A01470-43', 'source': 'clinical_trials'}, {'type': 'Other Identifier', 'id': '121347B-22', 'source': 'clinical_trials'}, {'type': 'Other Identifier', 'id': '12/45-878', 'source': 'clinical_trials'}];VARITI-5 : Study of Variations of Serum ITIH5 in Women During the Genital Life and in Pathological Situations.;VARITI-5;"The five proteins of the ITI (Inter-α-trypsin inhibitor) family, are essential components of the extracellular matrix, the dynamics of which they participate in the processes of cellular differentiation and proliferation. I. The ITIH1, ITIH2, ITIH3 and ITIH4 genes seem to be overwhelmingly expressed in the liver, this organ secreting then the corresponding proteins in the general circulation. The only data on ITIH5 indicate that this gene is poorly expressed in the liver and that the major source of its expression is the placenta. In the context of genetic studies on the syndrome of Mayer-Rokitansky-Küster-Hauser (congenital aplasia of the uterus and vagina), the investigators have shown the involvement of ITIH5 and implemented validation experiments of this gene in mice. The investigators have shown that the production of ITIH5 by the uterus varies greatly depending on the physiological state of this organ, especially during pregnancy and the estrous cycle. The investigators also found that most of the production ITIH5 was located in the uterus. Therefore, the serum dosage of ITIH5 could be used clinically as a new biological marker specific to the uterus. This non-invasive biological marker could thus assist in the diagnosis and the understanding of uterine pathologies. ITIH5 rate being correlated to endometrial proliferation, its dosage could be an early and non-invasive marker of endometriosis. The peak of production of ITIH5 by the uterus at the time of embryo implantation window indicates that the assay could provide a better assessment of endometrial receptivity to embryo. It then could be a hand tool of diagnosis in some cases of early repeated miscarriages, and secondly, a prognostic tool for embryo implantation in the context of in vitro fertilization.

The investigators conducted an initial feasibility study on the serum dosage of ITIH5, which was approved by the ethics committee of the University Hospital of Rennes. This first step has been validated. Now, the project is to perform a quantitative analysis of ITIH5 and to correlate clinical and biological data of relevant pathological and physiological situations. This project was the subject of a national and international patents of which the University Hospital of Rennes is promoter.";2013-01-28T00:00:00;;Completed;2017-01-28T00:00:00;Actual;2013-03-25T00:00:00;2013-04-03T00:00:00;Observational;Prospective;163.0;Actual;[];0.0;False;;Rennes University Hospital;['France'];['EFS de Bretagne', 'Rennes University Hospital - Hôpital Sud'];2022-11-28;2013.0;2017.0;56.0;during_study;1461.0;academique;True;Completed;['fr'];;[];Other;;;;;;;;;;;
